id,label,text
6271,-0.2689547810189145,"Bluetooth enable in widows?(you have alternate operating system (Windows) ?"
1632,0.4472954901834368,"ErrorDocument 404 index.php This does not seem to work for me. Any ideas?"
3279,0.33677535276020354,"As you say that you're not concerned about holidays (yet), is it fair to say that there's a fixed number of working minutes per week for a given SLA?  If so, can you just divide SLA time by minutes-per-week, and then sort out the remainder?"
386,0.47400695101934,"Is `getFreeCrawler()` synchronized? In which line does the error occur?"
4041,0.07530372935069789,"sorry to extend the question, but how would i block the ip address? (using PHP?)"
4221,0.25771498461412073,"Please tell us you're not trying to write a root-kit. Can you explain your scenario so that perhaps we can suggest a better security architecture instead of one that is generally considered ""evil"" behavior?"
4235,0.026763403126027298,"Nice. Could you please link back to the source?"
2969,0.29371086083327813,"Yes it is sorted. Can you explain?"
629,0.2838930746578811,"We thought about that as well..where do you see the advantage? Browser independence??"
2188,1.0108963821685202,"So you mean you just can't use date functions, yes? Presumably comparison, multiplication and subtraction are okay? :-)"
3151,-0.3765087174933413,"would we not read the second example as 2 divided by negative 5? Or do negative numbers go beyond the level of mathematics intended for this exercise?"
2238,0.12316152864371735,"So you're basically looking for the intersection between two non-axis-aligned rectangles?  (Or, if they collide at all?)"
3586,1.1866611563772218,"The very easiest way to tag an image is to use the Alt Text in picture's properties, but I have a feeling this isn't what you want based on your example. Can you describe more about not only what you want but how you plan to achieve it?"
237,0.150655295789656,"have you tried this? What output do you get?"
6091,-0.35918417029312694,"Can you make the raw file available? Also, what software are you using for conversion and what dSLR is it?"
3233,-0.931678589242214,"color(node) = if is_even(depth(node)) then ""black"" else ""red"" ... is that really the question? Or is he asking whether an AVL tree can be colored such that it obeys all the properties of a red-black tree?"
1496,0.39291027686144825,"I'm talking about UI design.  Should I use the MapKit framework; or, is there a third-party framework that you could recommend?"
1787,-0.08005274003175056,"Are those regexps? Otherwise you should probably use `str_replace` instead and see if that works better?"
4826,0.2218207400301367,"As a sidenote, I wonder why they chose to call it ""Reach""... I just got done playing some Halo: Reach so that came to mind immediately. But I suspect it's more because of the symbolism of ""reaching"" more devices?"
671,0.5837392864660422,"Is there any specific element you're targeting? Could you put together a sample structure?"
955,0.8333306210306294,"Well i would do that but i don't know how to. Maybe you can show me on thizs example please?"
1716,0.09090958938396045,"Wordpress is just an application framework, it's not a domain framework so its architecture must be rather rudimentary. What would prevent to integrate the wp skeletton inside a domain mvc framework for example ?"
5905,-2.205132225742786,"An empty inbox?  What's that?"
329,-0.2773377392777978,"Array.binarySearch requires your array to be sorted in advance. Is it?"
2229,0.05967884848983141,"Did you try an iisreset? Maybe an old version of your assembly is still in cache?"
6363,-0.3610731666763304,"Dunno if it's a language barrier but I don't get how seasoning can be connected to the rust issue?"
1748,-0.9157857573259404,"I am pretty sure SendGrid has this type of import and throttling build into their service. Why are you *doing it yourself*?"
108,0.5722813118372221,"@sarnold It shows 
Number of input = 22936722 49.Can anyone rationalise this strangeness?"
6421,0.4554610573347424,"Can you define butter spread for us? Do you mean margarine or other non-butter spreads? Or is there some spread that uses butter as a component that you're referring to?"
5060,0.7958286366948749,"Since you are using a process supervisor, you should not need pid files. Can you configure apache2 and postgres not to create them?"
4243,0.21168362732986065,"Hi @philippe. Since it seems like you found the solution, could you please post how you fixed your problem for future readers of this question?"
4176,-1.095429451194144,"Sorry, I should've made it clearer there are other text, figures and tables contained within leftbar as well - I omitted them because this was a minimal example.  So that doesn't appear to be an option for me...  Any other ideas Stef, or others?"
1763,-0.3149236973847561,"could we get some column names, and what do the id's reference? there is no ID you have given us on any other column... and what do you mean by ""somehow combine them""?"
2800,0.937242836409888,"Needs more context. Can you provide the question which precedes the answer too?"
3804,-0.7897930367162986,"If the ads are script elements, does it really matter where you place them? Perhaps you can give an example?"
4295,0.3473346929778464,"im sorry, what do you mean by ""application""? android calling system is stock.. As I've stated before, I cannot find the ""video call"" option when calling.. are there any workaround?"
3011,-2.0741352686697385,"You question is very incoherent. Can you ask it more clearly?"
5181,1.0702775792669832,"This sounds like an open ended hardware request, which is likely to get your question closed. Can you make your question any more specific?"
402,-0.5302365811028723,"Could you share the relevant information with us *irrespective* of whether it is an exception, and error, or something else?  Also, what does because I must there KeyPairValuOfStringAndCarType mean?"
1542,-0.17330610505833347,"Am I missing something, or what specifically are you coding this in? JavaScript?"
4703,0.4566369651480786,"This doesn't really make any sense. Are the word documents going to be downloaded from links on the site or do they just contain text FOR the site?"
1534,0.8632334441743573,"Sorry for the late reply,I have taken view based template.Actually I need to convert the pdf page to image and in that process it's giving me error with the code above. Any solution?"
1039,-0.04202031880470412,"Where really is your perl executable? /bin/perl or /usr/local/bin/perl?"
6508,0.15024263556367182,"If plugs are falling out, it generally means the metal contacts inside the receptacles are worn out.  (I'm guessing this is an older house?)"
1153,0.10319360501153267,"What have you tried so far? Is there something more subtle than just opening both files, reading lines from each, etc?"
4661,-0.037612352039468076,"$G'$ does not seem to add anything to your setup, as it is simply a forest of cliques.  You seem to be asking about the average connectivity of $G$, but what is the distribution of functions?"
2740,0.09204548096924553,"You need to be more specific on the clustering.  If p1-p2 < d, and p2-p3 < d, but p1-p3 > d, do you still cluster p1,p2,p3 together?"
2970,0.34571396792653786,"Is there something more to your question that you would like answered?  More details?"
2944,-1.1617799587297888,"since when was north 0 degrees, east 45 degress etc. Don't you mean 0, 90, 180, 270?"
3775,0.44143644548140654,"Your algorithm would presumably conclude that `{x,y,y,y,y}` and `{x,x,x,x,y}` are equal. Is that the desired behaviour?"
338,-0.16224407540670066,"What about a little more information? What is your question?"
5781,-0.04096397210853149,"How is the complex number c given to the Turing machine?  Are you considering in terms of Turing machines over real/complex numbers?"
2573,-0.8595955522740667,"Uploaded where? With what?"
3223,-0.8601958307447514,"@Unreason, yes its not an natural thing to grasp, simply put: Possible Haiku combination = Infinite; Number of Monkeys OR Time required to produce said Infinite Hakim = NOT possible, as in order to generate those Infinite Haiku's you would need a greater than Infinite amount of time Or GREATER THAN infinite amount of monkeys. Now do you see the contradiction?"
4556,1.1599435456174887,"Do you mean the launcher? Could you please provide a screenshot?"
669,0.4467623261976269,"So is there any problem/issue you are facing? What is the problem?"
587,0.1237322463289288,"Could there be quotes embedded inside quoted strings, and if so, how will they be escaped, i.e. `""Two by four (2""""x4"""")""` or `""Two by four (2\""x4\"")""`?"
6449,0.2324335566836359,"mm sounds good.  When you say little, do you mean like half a cup or less?  Also, wouldn't I need to put some additional liquid for the chicken, or will it just cook in its own juices?"
2874,0.20147414858559493,"It _was_ a homework, but few minutes ago there was a deadline (solutions should be submited online), so I am interested in solution, because I couldn't find any (solution wont't be presented in class and I am interested how to solve this problem). So, I thought I don't need to use _homework_ tag, do I?"
2165,0.5901876718012162,"By `In fact I already have!`, do you mean that you have switched to generics collections? Could you share your opinion about the performance?"
4489,0.18378641982298669,"Sorry that does not answer my question. My question is, why do not people study electrons, say, artificially confined on a scale compared to the size of the nucleus ?"
6284,0.35441488601827376,"Did you clear all the cache? How did you do that?"
3025,0.4315969245670749,"You might have a difficult time with any arbitrary quadrilateral if you allow convex quads and those whose segments overlap. Do you mean any arbitrary *convex* quadrilateral?"
5404,0.442454784491467,"@Mark, i.e. a perfect question for this StackExchange eh?"
2046,1.1613191845793145,"You'll have to give us a bit more context here.  Can you provide a code snippet that displays this problem?"
3662,0.025732467706049027,"The ""another set of numbers"" is unordered? With no duplicates (since it is a set)?"
673,0.005901000463496767,"if id=r2 is selected, id=r1 should be de-selected?  de-selection of a radio button isn't captured by this?"
4150,0.15778988633607655,"It's not very clear what you need, since TeX adds automatically `\hfill` at the end of a paragraph. Would you please add a ""real life"" example?"
431,0.10025136756836557,"Why not use a numerical counter, then convert it to text when you need to display it? What's in `element`?"
451,-0.653740358558479,"Why do you want to show multiple tooltips for a single control? Why not just combine the contents of the two into a single tooltip?"
908,0.6203699434964154,"im curious, why did you choose to use malloc()/free() inside the class instead of new/delete? also, what is your compiler?"
3595,-0.19122843223295666,"sounds like homework. what have you figured out so far?"
81,-0.11762494673128165,"Is there a particular reason you need it in binary format? Could you not use simple text output?"
2904,0.17751301739995914,"What about invalid states (e.g. all Os or both sides with 3-in-a-row)?"
3034,0.744877627470339,"What approaches did you try? What were the problems?"
575,-0.08102658592548004,"What is your specific problem? How to transfer the data between pocket outlook and your application?"
18,-0.643683605855573,"Too vague - explain what you expect the contents of the array to be afterwards - give a concrete example. Possibly also needs a homework tag ?"
353,-0.00537609919042401,"The layout for this sample code seems incorrect: why do you have a larger gap between the second and the third columns? Shouldn't it be between the 3rd and 4th columns instead?"
6237,0.5269118510511765,"Are you unable to change it back? Or are you just curious as to how it got changed?"
459,0.13770912349603562,"I think you might need to go over the basics a little more.  Have you googled, ""C# Custom Exception"" yet, to see what you get?"
1554,-0.6618656358382535,"I don't think anyone's going to be able to help you based on that information alone (considering we don't know what `0x306aeaa5` is). Can you post your code and tell us what the exact problem is?"
5938,0.5670089774369592,"What do you mean?  The best OS to do Arduino development on, or the best OS to run on your Arduino (a la FreeRTOS)?"
1688,-1.5680712938031536,"Updated!!!!!!!!! any one???"
4698,-0.31763894096819323,"Related answer: http://webmasters.stackexchange.com/questions/5376/seo-and-changeable-but-optional-urls/5390#5390 Edit: If anyone is knowledgeable about this subject, I'd also like to know how the canonical fits in when doing pagination or sorting. If the pages are showing the same content, but in different order, is it really the same page?"
6492,0.3219963478649883,"This looks awesome, but I got lost at ""You connect the two plates together with some solid core power cabling you can find at your local hardware store."". What is ""solid core power cabling""?"
814,-0.5963759337939998,"@Marc: Wow. Was it obvious that aali was a sockpuppet account?"
5853,0.8261464609102003,"This is hard to answer without more context - what is your threat model, your application, etc?  A general answer is at http://security.stackexchange.com/questions/1476/what-is-the-difference-in-security-between-a-vpn-and-a-ssl-connection so can you look at the answers there and either get clarity on those answers there, or ask more specific questions here?"
1408,0.09981953264957752,"What do you mean by ""view""? Do you mean how can you tell if the mouse is over the table view or if it's over a row/column/cell in the table view?"
210,1.358137353305805,"Sorry to up this, I found it via google, but it seems to work when the private static final field is a primitive type. Does anyone have an idea why ?"
5604,0.15953074362024414,"Worth noting that the Terminal app in OS X supports lots of windows and tabs. Does that not do it for you?"
1363,1.0873782188639685,"Can you clarify? What's the list supposed to contain?"
1023,-0.8659744475867798,"Can't you just filter out the value NULL before you process the records?  Or did I miss something?"
773,0.8788060433449226,"Here's a simple example based on what you provided: http://fbrell.com/saved/58a66f765babcdd3d7b452afe02b4e41 -- works fine for me. Maybe you can provide some more details?"
668,-0.09887749816593658,"You don't - you run a callback function (like @Alex's answer) or something fancier like `jQuery.Deferred` (my answer). But your question is unclear - could you show us some more code?"
6099,0.6652833167331964,"Just curious: why should you want to use live wallpapers ? Doesn't that drain your power much quicker ?"
1187,1.7383841908561553,"Looks like you're off to a good start.  What problem are you having?"
2052,-0.708747355515789,"I don't understand this. There is an infinite number of possible strings between ""a longer string"" and ""another long string"", so how can you guarantee unique values?"
1011,0.3049176390186267,"Does your file names follow a pattern? Do do they have common string as part of their names?"
4881,0.5052862369414087,"I am having the same issue with Google Sync and an iPod Touch.  The issue of ""null"" where it should say ""ipod toch""  Any suggestions on where to look?"
4329,0.512163928069531,"Pk, Please give me a idea. If we define primary menu like secondary menu, then primary menus(default) will be displayed or not?"
812,-0.7599512938002293,"What....?  How are these related?"
1186,-0.10483954920023268,"Can you phrase your question in the form of a question? Preferably a programming question?"
4766,0.4234251805961508,"Also: every app has XSS that could be displayed as HTML, XML, or a future markup language. Do you seriously want to have that argument?"
4471,0.01613849841759642,"@Omega Centauri - I think that strictly speaking, levelized costs are normally for *energy* rather than *power*. Anyway, can someone with the rep please move to close this question, as it's speculative?"
5020,0.2547188648942583,"Ebay links are ephemeral, and often disappear in time. Is it possible to find another example link?"
1706,0.16390902807369093,"Is there any other output in your script?  Is there any whitespace before `<?php`?"
5418,-1.019026937070346,"Unless I was forcing a developer to work in an unfamiliar language, not only would I not pay for their IDE I wouldn't hire them if they didn't have it already. You going to charge them for your time to install and configure it?"
1040,-0.1842766870491116,"What is the output of `perl -e 'print qx(type pwd)'` ? `perl -e 'print qx(which pwd)` ?"
1415,0.0953634117747596,"@Kerrek SB : What do you think about when talking about a formatted output ? stringWithFormat does not do the job ?"
3689,0.3969481152905348,"Do you have the ability to authenticate users (through login or whatnot) and to ""grade"" them, a bit like SO users. In this fashion you will soon get enough ""trusted citizen"" susceptible of flagging offensive data ?"
4230,0.2385029993669445,"@Steven: Sorry, don't follow. Can you elaborate?"
5129,0.6321102828393278,"All, I have some ideas for Palm Springs meetup locations (just by looking on Yelp). Should I start a question in main or meta, add my locations as answers so people can vote and also add their ideas for meetup locations?"
1329,0.8509076116514571,"Sorry, I thought I had. It's a simple game, ""Guess My Number - The computer picks a random number between 1 and 100> The player tries to guess it and the computer lets the player know if the guess is too high, too low or right on the money"" Forgive me, I'm new here, should I have explained further?"
819,0.0950593623991572,"Your image is 8 bits per pixel with 3 channels? Did you mean 24 bits per pixel, since that's what the RGB masks you specified seems to suggest?"
6348,-1.4213009695837238,"Seriously, have you tried Googling for ""home automation""?"
5087,-0.04343919096831529,"`at` should do exactly what you want. Why make things hard on yourself by insisting on a more complicated solution?"
385,0.19395029214145493,"What method is giving you the ArrayIndexOutOfBounds?  Can you print a stack trace?"
5588,0.38973917791125107,"This looks like a bug. Do you see high numbers when the program is NOT marked ""`Not Responding`""?"
2492,-0.2304720975094057,"I can't see how there can be a faster one. How can you detect an intersection without looking at every line, and so O(N)?"
961,0.09432085653998233,"How are you planning on passing the type information to the database? (or should I say, how will the database receive it?)"
3744,0.2797728890212953,"I don't understand exactly what the rules are. Are you only allowed to pick one number out of each row and only allowed to pick one number out of each column, and you have to pick 4 numbers, and you want the sum of these 4 numbers to be minimized?"
3697,-0.048082922874597284,"Are you interested in operations such as `Add(x, y) - add an interval to the tree`, `Query() - find the maximum number of overlapping intervals`? Do you also want `Del(x, y) - delete the interval [x, y] from the tree`?"
5338,0.302288544106461,"@sorich87: I [recommended user402 to do this](http://meta.wordpress.stackexchange.com/questions/122/can-i-use-your-answer-option-until-i-get-access-to-comment-on-others-question/123#123), since adding a ""Me too"" answer or comment would also not be the correct action. But maybe this is [too much a support question, and not fit for this site](http://meta.wordpress.stackexchange.com/questions/59/should-wordpress-answers-be-a-solve-my-specific-problem-site)?"
3238,0.24505790259814886,"reduced it onto sat, though number of clauses is much too high for a sat-solver. any ideas on how to divide and conquer this?"
5705,0.7480936499668904,"I can't reproduce this. You have selected `Taxonomy: Term` and not `Taxonomy: Term ID` in the Sort Criteria box?"
5807,-0.2390124549745401,"Why do you not want the cookies to be there? Does it matter as long as the content isn't being tracked?"
5531,0.07084372253456148,"@Ngu: There is some form of 'solution' for the three body problem. However, is there a 'solution' that converge faster than the using simulation for the same time period?"
3917,-1.1290960865445503,"@Andrew I beg to differ, the examples aren't good enough to explain what he wants. It's like saying ""I need *something*, for instance a car, so can you help?""."
3080,0.12092821887497801,"@S.L. Barth Exponential in terms of what parameter?"
2451,-0.21764008782069627,"Assuming the domain of the hash function is larger than the range, that's impossible.  If it's not, why bother using a hash?"
5757,-0.45317141374247,"I've always pondered if there were any 3D games classified as ""Metroidvania"". Do you know of any other than the Prime series (which I've always considered in the spirit of the classification, but never really dwelled on it)?"
936,-0.2277881450404537,"You need to show the declaration of Patient. Are you sure you're not writing pointers instead of complete strings into the file?"
1566,-0.485255759631796,"As the log mentions, BTServer is posting a notification called BluetoothAvailabilityChangedNotification. Why don't you suscribe to this, and any other notification interesting to your app instead of reading and parsing the logs?"
6170,0.04886323257642435,"Also, are all of those examples supposed to be sent through the subject line? Furthermore, what happens if I include something in the message body?"
4065,-0.22236334044766046,"I'm sorry, but I can't understand what exactly you are looking for. What is your independent variable (the function), the dependent variables (the input values) and the parameters are?"
3630,0.6744868130144296,"you can do this with a container that is positioned absolute/fixed with a width and height of 100%.  background can then be set to `background-position: center center` I think?"
2859,0.3401918606472739,"What are ""the proper elements""? Are you given *two* matrices, one the ""source"" matrix and one a ""target"" matrix and you must decide in which order to ""encounter"" the elements so as to get the ""target"" matrix?"
3528,0.3046411915951471,"Perdon, la pregunta no esta claro. Puedes tratar a simplificar la pregunta?"
5111,-0.9956587045857644,"You can't create a geodatabase in ArcMap, unless you are referring to the ArcCatalog window inside of ArcMap.  Did you mean a 9.3 version of an .MXD file?"
3729,0.9099730176737872,"i know this doesn't help your problem but it's another corner case: what if two different cells want to swap with the same one? will one swap and then the other swap with the one it didn't intend to?"
217,-2.402281835300162,"You think mapping strings to a variable's symbolic name is a good idea?  Why in the world would you think that?"
93,0.509016995384515,"It may be redundant in source, but is it redundant in binary? Is it a good practice to always check code like this because although all statements depend on the ones before them (in program flow), the program flow may change from any number of sources?"
25,-0.3941291575721385,"The nth letter? Is this the Roman version of the Fibonacci sequence?"
1466,0.3632927877438088,"What results do you get? Does the debug console tell you something?"
2579,0.6971025515846038,"Setareh: I'm not sure if you mean that PRINCE2 suits large projects but not small ones, or vice versa.  Can you edit to clarify?"
2153,-0.11973628456160705,"Are your images stored as binary or strings that are path's to the files on disk? Why don't you want to use a load of `<img />` tags wrapped in `<a/>` tags?"
1419,0.6855535951186359,"What platform are you coding for? iPhone/iPad or Mac in general?"
1952,0.958982820189469,"Also, your question is a bit unclear to me. Can you provide an example of what `array` could be?"
1212,-0.2490558271495465,"Do you really mean 128GB of ram? Or 128MB?"
4989,-0.16612169314810726,"I've heard rumors of Pb-Sn solder being incompatible with certain RoHS PCB finishes.  Does anyone have real data about this?"
4930,0.5191273890265372,"That code works for me. Does it work for you if you just use that in an otherwise empty document?"
1312,2.014056758229134,"@delnan: thank you. Do these work under `Ubuntu`?"
2798,-0.9389339889206892,"Language? Framework?"
2626,0.17650496279922914,"Can you point to some atricle(s) with a formal definition and a motivation for this problem? Maybe also with some upper and lower limit estimates, prior art etc?"
1443,0.19008641460011785,"Do the stream auto-close when it is deallocated? If not, does it affect the battery life?"
453,0.4117181970031717,"I think the most likely error is that the <form> tag in the master page (or whatever page) doesn't have a runat=""server"" attribute? Can you post some code to help us pin-point the error?"
1825,0.29639341919369233,"What does the model's source look like? What happens if you `Ad.reset_column_information` before `Ad.create`?"
3548,-0.20392419584521326,"could you add some code? does your `<object>` tag have an `id`?"
3276,0.16898177857346489,"@Oscar: What type of database are you willing to use? Access, MS SQL, MySQL, Oracle, or other??"
2082,0.6951432066699184,"Sorry if this is a stupid question. Is the output exactly `<%= debug @articles %>` or is the output actually a yaml formated object?"
6510,-0.34781293012038145,"Any chance of following this up?"
984,0.1977689488783184,"Which O/S? Are you asking how to write/architect the user-defined code, how to compile it, or how to load it after it's compiled?"
5131,0.09250835828843379,"@Chad Agreed.  But can we make it CW?"
5069,0.7001269582992222,"I was somewhat confused, but after a while thinking I agree that although requiring the same answer, the question is different. Is there somewhere a guideline to this?"
1501,0.1020195884229882,"UniversalIndentGUI is a front-end for many different formatting tools. Which one are you using?"
