id,label,text
3155,-0.21897354927359264,"Can you confirm that your event is firing on each window resize and not just when the window loads? Can we see you code somewhere?"
6210,-0.4535006484853651,"Couldn't this have been appended to that discussion? Or googled?"
3446,-0.34580008485507896,"How can an Action take a fixed amount of time (Action.time)?  Shouldn't an Action's time be dependent upon the time it takes to accomplish each of its Tasks in Action.dependencies?"
331,0.023877591351059862,"I have modified my job, so it doesn't use such a large heap, but also at this time I have changed `HADOOP_HEAPSIZE`. And I don't see real outcome of this chagne, I mean: Why set heap smaller than: amount_of_my_RAM / number_of_mappers_or_reducers?"
2122,-0.01914570267664888,"I don't understand.  If you choose S' = {r} where r is the root, then \sigma(r) = V.  Do you mean sigma(s) to be all the elements less than or equal to r and greater than or equal to s (where less and greater are the lattice partial order)?"
4192,-1.0293008604827345,"thanx 4 answering my question....                                i already tried ice, but after 9 degree C, LCD went off.so i didn't go 4 boil water but used soldering iron 2 show dat ckt is working. can u please tell me hw can i check temp of liquids like water with this ic?"
3984,0.3635571214799865,"Are the edges are equally weighted? If not, how should differing weights be handled?"
3320,-0.2266471316760163,"A few questions:
Do you know the number of elements in the sll?"
6428,-0.923172541651486,"You can narrow this down a bit; are you on a mountain bike? A road bike? A 16"" folding bike?"
2486,-0.17447203371102427,"finding GCD recursively is the fastest known method. Do you want some kind of special optimization?"
3910,0.6947044037628755,"You may break up to three sets trying to form a street (or the other way around). Is that ok?"
2936,0.15702581919925512,"Is the BST balanced? Are we allowed to make changes to the tree and revert back?"
4789,0.8165730815491935,"@AviD: Cool, thanks! The original question asker gets to decide who answers the question, though, and can then just select his or her own answer, right?"
1790,-0.3963197766386256,"what is the goal here?  echo (no concern for storing in php var) some fields from the X most recent rows meeting the max conditions from any of tables that begin with 'whatever'?"
4144,-1.0255005306701466,"Under ""normal"" circumstances, that space shouldn't be there, unless explicitly added. Can you please add to your question a [minimal working example](http://www.minimalbeispiel.de/mini-en.html) illustrating how your footnotes generate the extra spacing?"
1141,-0.09769369015875863,"Can quotes be escaped? If so, how?"
2312,-0.18678911838398424,"What I find confusing is the connection between the title of your question and the actual question. Can you explain?"
1146,-0.5554670941326186,"Golf? Obfuscation?"
6207,0.38040210154833937,"Too general? Perhaps this should relate to a specific problem: ""How are monte carlo simulations used to model _x_ in physics?"""
777,-0.5449096031994565,"you mean as if you'd print screen it ? or what?"
5082,0.1385839302195448,"Your symlink might have been removed by `ldconfig`. Your description is confusing, could you edit it with the exact file names involved at each step?"
6569,1.0476904856081943,"Thanks for the update - where did you find out that the construction has changed?"
2057,1.1322992799800635,"Depending on the CUDA version you are using, device emulation may not be available, as it has been deprecated and possibly removed.  Is it feasible to get another GPU (a cheap one for display maybe)?"
4379,-0.275292463913794,"@Lorenzo - I think I've heard something along the same lines in the 80s, for Fortran, COBOL, some other less known languages as well. Sorry, all still here :-) On what basis do you make these conclusions?"
5796,0.02071118767727837,"Automating in what way? What information do you want to extract?"
4949,-0.03249245776692322,"As @Willie Wong says, marginpars are already floats and should not end up overlapping (although they may not end up where you want them to and long ones may overflow the bottom of the page, for which problem there is the marginfix package). Are you using some unusual class or package that redefines `\marginpar`?"
1207,0.09746024955326944,"Could you please show your setup.py file? Also why is your setup.py in C:\Python27?"
2550,0.14663539777528065,"@peterjwest if that is a room and you use rectangles for collision detection you'll get a lot of false positives. Or am I missing something?"
811,0.43473626535972587,"I am running Windows 7. What built-in tools should I look for?"
6003,-1.021718332147125,"What did you end up choosing? I'm looking at using custom layers or plug-in data source are there any more issues other than the ones you and Kirk mentioned?"
605,0.21523404169095145,"[`class` is reserved as a future keyword by the ECMAScript specification](https://developer.mozilla.org/en/JavaScript/Reference/Reserved_Words). Also, what if the element has more than 1 class?"
5628,-0.7352606158677859,"@shodanex: The issue is likely to be specific to your particular hardware (or virtual machine), so you should describe it. Also, does the clock still drift if you turn “synchronize with internet” off?"
2717,-0.7072918525796632,"Why is your `i` loop going from `j:6`, rather than `1:6`?  Have you noticed that `sum` is being recalculated on every iteration (overwriting the value from the previous iteration)?"
3885,0.014602108845822706,"what exactly you mean by parsing? the conversion from your NSString number to unsigned long long?"
4609,0.3323022356765943,"Sorry for the TLDR syndrome. Can you make a `dpm($variables);`  (using [devel](http://drupal.org/project/devel)) just after line 229 to inspect the content of $variables ?"
828,0.8215409756538626,"first thank you all for your answers second i cant understend jim why you think i try to make fun of you? and last how i mark that the problem solved?"
2913,-0.3342359248397219,"While I answered your question to the best of my ability, I fear that you are going down the wrong path. Are you explicitly closing your SqlConnections in the same function that opens them?"
3576,0.2428899824177849,"@honeybadger, How big are the integers? Easily Factorerd?"
2604,0.02259551367481639,"What exactly does connected mean?  If two dots are both on and are adjacent is that one connection?"
5035,0.07899664322616314,"It was a joke. I mean, surely, a carbon frame has a major carbon price tag?"
5279,-0.04461818514800472,"@Itai, your dislike of vignetting is hardly a reason to judge something as too subjective and therefore to close it. Is this site for technicians or photographers?"
1683,0.308495507435106,"Well if that is.. I don't think the DI Extension is being loaded. How can I check this ?"
4555,-0.5446250797721379,"You may be experiencing [bug #732677](https://bugs.launchpad.net/ubuntu/+source/bcmwl/+bug/732677). Can you please edit your question to include the output of `sudo lshw -class network` and `lsmod | grep -E 'b43|ssb|wl'`?"
3932,-0.3741889155026358,"If it is always complete using numbers from 1..N you could just write the values 1..N to the input array.  So I'm guessing thats not going to cut it?"
3649,-0.2274603995887377,"google? wikipedia?"
4300,-2.487294942969407,"This is a pretty broad question. Can you be more specific, please?"
2145,-0.16553653440744376,"Job interview? Or homework?"
511,0.2762403209840307,"Can you create a short but complete program which demonstrates the problem? Are you sure you've got the right using directive *in the file which contains that line*?"
4528,0.21694801903571656,"Please mention the version of ubuntu you are using, as well the catalyst ( fglrx) driver version. Do you experience tearing or any other distortion?"
115,-0.766747117083604,"@Jeff OK, OK. This is how wiki works though huh?"
768,-0.870200304817527,"@felix, why? isn't he just creating an new object?"
5941,-0.2576848783145965,"AC or DC power supply? What is the power supply voltage?"
3291,0.20838937062168664,"I see unbalanced brackets. Is line 21 in C:?"
5865,-1.3895286298490066,"For what purpose? To make the game or to pitch it to an investor?"
6484,0.15641025278919188,"one other question. Would I still need to install mercurial on the remote server over SSH?"
5518,1.3244549545763915,"Sure, no problem. Jesteś z Warszawy?"
5166,-0.06940385121765096,"@Macha I also upgraded to Ubuntu 10, and it still works for me.  What terminal?"
9,0.5193977291601419,"Does your project involve some graphical user interface? What do you want to code?"
5056,0.22218585117310435,"dirs -l -p gives me `/home/phunehehe`, and running L=\`dirs -l -p\`; echo $L always gives me `/home/phunehehe`. Why are you using it to test ""multiline output""?"
4077,-1.1996660263660073,"sorry nothing related to the original question, but do you know anything about the australian electricity market? Seams quite stable, especially with all their coal easily available?"
2751,-0.4131285588471112,"and what if you make other browsers default i.e. in the asp.net process then ?"
2012,0.8304383669836882,"Do you always start from 0,0 (or the bottom-left-most point)?  Or can you start from any point?"
6039,-0.8714967085680445,"Nvidia dedicated graphics chip? Could you be more specific?"
2686,-1.2847860812711729,"There is still ambiguity - `1 3 5 4 2` is zig zag according to YOUR description of the problem, but NOT according to the topcoder description. Do you see why?"
5819,-1.6902479529239025,"Does anyone know how to estimate a difference in difference regression in gretl? Do I have to work with OLS or panel data?"
519,0.4741002411118458,"The resulting table shouldn't have that primary key. What provider are you using?"
1578,0.15770793792696913,"You could always configure the formatter manually, to precisely your requirements. Do you always want values to be displayed in cents?"
4696,-0.04648018637340422,"Do you want real data, or just test data (i.e. fictional)?"
1832,0.5458969588267704,"Is it possible that it could be a passenger issue? Does devise/warden cache the current_user variable?"
1971,0.02118656822946098,"Server code is only obfuscating the real code : your HTML + CSS code. Could you please provide an URL or the HTML + CSS of the containing block?"
1179,-0.21314560289057066,"At the very end of your test string, ATT and AAAA are back-to-back separate matches. What then?"
4495,-2.3163618529367045,"""non-default screen resolutions when using virtual display over screen sharing"" — a statement, not a question. Please: do you *prefer*, or wish to *avoid* the non-default resolutions?"
3707,-0.5346255696537398,"Sounds like 'can anyone show me how to iterate over array and execute function on each element'. What's the problem with iterating it step by step, just as you described?"
753,-0.7350527181449094,"What part of that are you confused about? [this](http://www.quirksmode.org/js/this.html)?"
665,0.29500592593907704,"So you are having multiple instances of a form structure (same structure) one for every user and you want to save *only* the corresponding user's info when that form's save button is clicked. Is that the correct requirement?"
2650,0.459360628807124,"Is the viewport fixed sized? And is the image fixed sized?"
4210,0.1571595565854753,"Please note the question, ""What are the remedies for when one bonks in the midst of a long ride? Essentially, what is the first aid so that one can continue?"""
4054,0.1988351153974292,"Sorry to ask, but do you want to test trails and patients are independent? If no, can you please specify what does the Chi-sq test intend to do?"
905,0.20776850269125266,"What is `someclass`?  What line does the error message correspond to?"
2497,0.2408923193661399,"How would you store those cached images? in your own NSArray?"
4573,0.4231276047514861,"please can you add to your question the results of the following: `sudo lshw -class network` followed by `rfkill list`. Also - what happens if you deactivate the B43 driver and activate the STA driver?"
2411,1.2057529862074887,"Not sure what you're asking exactly.  Can you give an example of sample input and output?"
5861,0.11292255539007184,"And how are you planning on handling this on the client? Phones today dont have encrypted SMS builtin, which means you'd build a custom app... and if you're doing that, why bother with SMS?"
1035,-0.38413679271876894,"@Colin why aren't they defined? Of course they are...or in which circumstances they aren't ?"
4543,0.8386133636201728,"I'm not sure that I understand the question. Can you please elaborate?"
2762,1.6586147808284897,"Understood, been there. ;) Maybe I'll check out Carrierwave (HVAC?)."
4484,1.5326563452012976,"My brain has been scrambled a bit by your sentence: ""Essentially there is no way to distinguish between an object at rest or moving at a constant velocity."" - can you elaborate please?"
1684,1.2125815733422955,"@zildjohn01, What's the best way to do this (which PHP functions?). Could you leave a detailed answer with your approach?"
5010,-0.11498008776418285,"done. Also, I edited your title to be easier to scan -- is this what you had in mind?"
4545,0.7304733328900958,"Please be a little more clear? do you have the printer attached to the ubuntu machine or the Windows XP machine?"
4882,-0.349953753031779,"It's first choice in mine version. But what is this Custom there?"
2385,0.2698685537925748,"Also make sure that your test input is exactly in the format that you are given by the bot. Does your program cope well with an input ending with a newline?"
3693,1.173528534560072,"I like your idea of relativ dimensions and positions. What didn't work well?"
758,-1.4176608491616347,"after trying to edit your post I realize your syntax is totally bunked or you copied and pasted it wrong. Is this everything?"
4958,0.01246264072394072,"If pin C0 floats HIGH and C1 is connected to AREF which is also HIGH, then there shouldn't be any change.  Did you try connecting C1 to ground to get zero when you run select_wire(1)?"
3197,0.367590511694384,"I'm afraid to step into the love jungle. Can you post a screenshot?"
2633,-1.1200558942476349,"Seems like a rather big project. From what I can read, you have no experience in programming?"
4788,0.8653401406684631,"And NFS and DNS and other stuff too. Can you provide a breakdown by port?"
2008,0.4569009794683807,"What have you tried so far? Do you have an attempt at making it work which fails?"
2410,-1.6430411794625424,"Why are you debugging AutoCAD? Isn't that AutoDesk's job?"
1525,0.44446276860640255,"you already release FootballScoreBoardViewController. Can you show your code ?"
1571,0.018434320890145385,"What do you mean by smaller? Do you mean truncating the string?"
1549,0.03309003879163488,"I'm testing it using the simulator. I can't find anywhere in the simulator to disable daylight saving?"
272,0.433522584226722,"somewhere from the run dialog of JDeveloper. But are you sure you want to use this IDE?"
5107,0.058800744639065886,"Sounds like a projection issue. Is the shapefile projected to a different coordinate system than you're used to using?"
5470,0.9190614153568198,"This has since been part of the site. Is it still useful?"
2164,0.499570326276341,"Could you better describe for which elements of jqGrid you what to set the background image? Do you want to set it on the grid title (the capture layer), on the column headers or replace only the sorting images in the column header (see the pictures [here](http://www.trirand.com/jqgridwiki/doku.php?id=wiki:how_it_works))?"
3966,-0.16225242113651264,"You are building a xFA for the _byte_ input? Wouldn't it be a lot easier (and more reliable) to operate on (Utf16) chars?"
571,1.5664348414326832,"Perhaps this is not a good candidate for binding to a property grid.  Can you set the property, save the result, have that return instantly, and then later on, based on some user action, run your long-running operation?"
744,-0.2785846506911909,"3) and 4) look broken to me. Did you mix up `and` and `or`?"
5658,0.14277165501922834,"This happens when the system can't start another X server with the second (new) user - it disappears and goes back to your (locked) screen. Can you post up your graphics drivers' configuration and the hardware specs?"
6314,0.08058819049642382,"do you want something non-alcoholic?  Or is some other alcoholic beverage acceptable?"
1084,-0.6580059493323153,"@brian Actually, yes. Is that possible without causing the ""world to burn""?"
1248,-0.6702641859355964,"Why are you doing `{% ifequal gallery.draft True %}`?   Why not do `{% if gallery.draft %}`?"
319,-0.3439135059900348,"It's still not clear. Does the URL have to contain `.com`?"
667,0.4406836027851823,"@tjameson Ok, If I keep the `{10}` I should be able to ditch the `length != 10` right? or is it better not to?"
5833,0.03656420911817016,"@Tal, @John -- I know how standard vioplot works, but I can't figure out how those points were obtained (and as I see not only me, while it is crucial for producing good answer) -- some kind of stem? Or maybe someone just thought that filling vioplot with distorted polka dots is a good idea?"
4508,-0.2755693865791101,"Umm.. *what* means it is connected to GPRS? Sorry, I lost you — which part of the question are you referring to?"
5703,1.997941460114112,"How did you fix this. It doesn't seem that simply moving your views into separate modules would work?"
3264,-0.704568867971189,"If input is {{a: 1, b: 1}, {c: 1}, {b: 1, c: 1}}, do you just want {{a: 1, b: 1} , {c: 1}}, or all 3? If it's the former, what exactly do you need this for?"
5888,-1.8814908364425145,"This seems OT?  @LBushkin, do you think this would be the right site for this kind of question?"
4375,-0.09191217181099273,"Please clarify - are you going to charge your boss for this? Or is your boss going to charge a client?"
2298,0.02557215478268809,"No half cells no. The distribution of window sizes, smallest should be 1x1, largest... I'm unsure, perhaps 64x64?"
4353,-3.146463729423937,"I'd like to know why someone voted to close this as Off-Topic.  Can you please explain your reasoning?"
1963,0.9552592779587854,"Is this happening in development only? Is it possible that class reloading is the issue as classes are not cached in development if you are adding methods during execution the class could be reloaded without your newly defined methods?"
1795,0.15169976941849347,"Are you sure you're not escaping the whole query string? Could you include your query calls as well?"
5676,1.1365567764730653,"When displayed, the menu link will use the defined path alias. Any reason why this isn't enough?"
4928,0.04761280303032615,"Your question is not very clear, but let's see if I can understand it. What you want is to obtain the `\mathbb` font from the `fourier` package but *without* changing the rest of the fonts?"
3501,-0.051402850285150035,"@charles fox: should it be lossless? Are the images line art or photographs?"
4845,0.1472208938482938,"It looks like you get either wrong character widths or kerning values. Did you try disabling the kerning altogether to check if you get correct character widths this way?"
2297,0.5196703971442677,"1. Need table definition, data in the tables, etc 2. What have you tried so far?"
3763,-0.4682180959097736,"Looks like you're passing null to an API parameter, particularly a null Overlay somewhere in a mapview probably. How are we supposed to know?"
4115,-0.21083017972660026,"i'm sorry could you explain what you mean, i'm not sure if i understand. Your saying we should break them into 1x1 tiles?"
5522,-0.8933241505899043,"""I've simply been told before that itsa flow of electrons, but this seems to basic and does show that electricity is instant."" Why would this mean that electricity is ""instantaneous"" ?"
5364,0.3730481149692453,"@edelwater: well actually this should always work on a vanilla wp install and cookies enabled in the browser. Just out of curiosity, what did you notice in wp-admin redirects?"
5859,-0.4416122796339865,"Wait, my previous comment may have been jumping the gun... What is it you're trying to do? Get access to someone else's record, or go for the bigger SQL Injection vulnerability there?"
2988,0.5787915251610539,"seems fine in Chrome. How exactly does one reproduce the problem?"
685,-0.08895541552606559,"It should prepopulate from that json url. Are you sure you followed the guide?"
2713,0.5099306490641698,"@Gnovice: I thought about that, but wasn't sure.  I remember wondering the same thing a long time ago, so I figured, ""why not""?"
5132,-0.353232233341064,"This sounds a bit ambitious for using the Google Maps API. At the very least, you're probably going to need a back-end server to run this -- what are you using?"
964,-0.017140746577568918,"Those are not runtime errors, they're from the linker!  As Richard Pennington suggests, there's probably a problem with the way you're building it under Unix -- perhaps linking against the same library twice?"
4067,1.0683725471278327,"$N$ is not know? Could you please confirm?"
4916,0.5088041172153579,"The link you gave isn't a repository, but a page with links to the repositories for various fedora versions. Did you try those links, or did you somehow try to use the link you gave as though it was the repository?"
5281,-0.9497538318665828,"The ""shaped bokeh"" effect is a special case. Does http://photo.stackexchange.com/questions/2706/what-is-bokeh-really answer your question?"
2808,0.33224566620265217,"Do you already have similarity scores? Or are you asking about how to define a similarity score?"
1591,-0.8625571926840242,"Hey Geek Could U pls guide me to start learning the basics of flurry analytics in android? Where can i find its tutorial kind of things?"
2032,0.6227736436629073,"It ought to show up in the Delphi Window _and_ in DebugView. Can you confirm that's happening?"
134,-0.978710638521732,"*lol* the war against crackers is stopping our white-hats to learn the trade. Maybe the criminals will go away when we don't know how they do it? ;)"
6134,0.1960135202780584,"Another MySQL database, or another database type?  Do you still want access to the regular WordPress database, or are you moving the site from one DB to another?"
2268,-0.5798462628003723,"Innovative?  You mean, something that uses genetic algorithms that cloud compute on quantum computers?"
981,-0.15007466719637602,"what do you mean with ""WCF hosted"" ? can you provide sample or references ?"
5919,-0.5968365286980098,"Do you really need to produce separate pdf files? Maybe the `\include` and `\includeonly` features would be enough for you?"
1846,-0.6991026163071321,"Your second code snippet is the same as the first. Did you not paste it in correctly?"
3119,0.2512056751963484,"how are the cross sections given? polygons?"
1426,0.5942827186326352,"Ok, this a long-shot, just a crazy idea, and I haven't tried it myself, so I won't submit it as an answer:  How about keeping the UIImageView stationary and moving the UIView around behind it?  You might then be able to use transforms to translate or scale your UIView, and transform the scrollview at the same time?"
2793,0.6026417162882195,"@Unreason About the rectangular case - think of the situation when points aren't positioned in a rectilinear way (basically, the points inside the rectangle can take any position and, hence, build complex curves). If I have some matrix with these points, what should I do to make my mesh resolution larger (in terms of points per square inch, for example)?"
3572,0.2652618925700289,"Is *r* necessarily positive? Is it an integer?"
516,-0.8407210366072484,"Show some code. How to you show the csv file?"
845,-0.13502305338814966,"In what way is it failing? Exception?"
6574,-0.2725698806689315,"Just curious, how much did the leveling job cost?"
1229,-0.024543235954535725,"Post that part (filesystem events) as a separate question. Is the output of `os.listdir()` always what you expect it to be?"
5862,0.4028989006692235,"@Michael also pitfalls - are you talking about performance, portability, productivity, interopability?  Most have seemed to have assumed you were thinking about Garbage Collection?"
1836,0.6079011347653648,"Have you tried connecting manually using telnet? If so what prompts do you get for username and password?"
376,-0.21048362442956772,"i just want to know the logic of how this can be done. or if anybody can show with simple example for this calculation?"
4822,0.027246815072353745,"An articulated body is not light on a physics engine as many shapes will be close to eachother and need to be tested for penetration (assuming they are jointed close together). What amount of shapes, what kind of shapes and what kind of contraints are involved?"
5332,0.9504933862217468,"""...nginx rather than wordpress."" Perhaps you mean ""nginx rather than Apache""?"
4486,0.13728952963127833,"The Wikipedia page does not say anything about single electrons, and the original paper, ""[Das magnetische Moment des Silberatoms](http://www.springerlink.com/content/q47427674u801u22/)"" seems to refer to silver atoms - not sure about this because the paper is in German and behind a paywall. Can you please clarify your answer?"
5064,0.2300671440510427,"This depends on the distribution you are using and the xorg it ships. Could you add these informations?"
5723,1.2482437379403193,"Eh. Fresh pasta takes less than 3 minutes to cook in boiling water. Why would you need to microwave this?"
618,-2.0778131663951416,"any code? or do we have to guess at how you did it?"
221,0.2154520663998445,"How exactly does a test fail, i.e. what do you test for?"
1048,-0.4536185242287669,"@hippietrail: Truncated how? and on what OS?"
