id,label,text
3694,-0.5728415208528226,"You're going to have to be more specific about what you want to know.  What kind of platform are you using to implement these algorithms?"
1711,-0.2720200305830858,"PHP is not made for long run. Why do you need it?"
1618,-0.4358642032866934,"Not my question, but okay. Would you care to elaborate on this and  tell me what exactly is wrong?"
3455,0.42075625946273415,"Ok the table has few nvarchar columns,couple float columns ,a ntext column
I observerd that the error is caused when I am filtering for the columns but couldnt find which column or row?"
97,-1.7696948196579736,"Why not K&R? Was this just an excuse to bad-mouth some books you didn't like?"
6104,0.3706562466332193,"What Android version are you running? Froyo 2.2 already has wireless tethering so that should do it for you otherwise can you upgrade to 2.2?"
548,0.753024348483367,"How are you using the FtWebRequest class? Do you have to problem with all FTP servers or just the one?"
5889,-0.6127938321085721,"And you logged in here how? What's with the fake questions?"
1649,0.5521568659754784,"Maybe you should give an example of the array too? As I understand, you want to delete entries from an array, using only php no JS?"
3614,-0.16788469819437124,"Why not? Wouldn't it make more sense to build your API and your charging model such that you _encourage_ innovation?"
3805,0.33903663188944033,"Do you want a solution to the math problem? or just an O(1) (memory) algorithm to do the job?"
3054,0.58773060987913,"should the output rectangle have its sides parallel to the axes? ie. can the output rectangle also be rotated?"
6526,0.6216975994129452,"@freiheit: Thanks for the answer. Where can I get these items? Can I get some of them combined (whichever I want to have) or do I have to buy separately each of what I need?"
3076,-1.612545968428318,"sounds suspiciously like homework.  if it is, what have you done to solve the problem yourself?"
3381,-0.3913806482894899,"shouldn't it be simply n! (if n is the lenght of your string)?"
5183,0.5393171118530207,"@Juan yeah, i figured it was something like that. Where is this magical chat room anyway?"
4239,-0.5649266861857611,"This post says some things about ""ownership"" and ""GIS"" and ""land"" but there's no recognizable, unambiguous question.  Could you please clarify and repost?"
6276,-0.6103044810594742,"Which way are you trying to identify it?  From within code?"
4523,-0.646779029323142,"I think you've got a typo here, I doubt that command returned ""How do I find out which process is eating up my bandwidth?""... ;) any chance you could edit the question please?"
1799,0.6182680163989173,"For a single one-off script, for a web project (e.g. Rails, Sinatra, or other) or are you creating utility code that you want available for many scripts?"
12,-1.5258712056846406,"""Cant see the error"" ? You mean your compiler crashes as badly on this code that you even can't tell us what he is complaining about?"
1500,-0.15263319835379352,"could you mark fluchtpunkts answer as accepted? so that people can see by one blink that your question is solved?"
5946,0.23069328750085294,"I haven't seen the LBE code, does it give any more information about why it won't initialize?  Also, is the hardware list up there complete, or are there any other sensors/whatnot connected?"
470,-1.198791291393866,"I'm not sure what your problem is. Aren't you sure about how to automatically data bind it?"
4644,0.6379052697874737,"D-Wave!  Have your lecturers recommended their technology to you?"
1333,-0.21771130065319416,"Why is it necessary for there to be no data there? Is it because you think it's faster that way?"
3591,0.4056947484676625,"3d is often hard to explain in text. Can you give us a sketch?"
104,-0.4546921573453052,"What do you mean by ""character""? The drive letter?"
5037,0.16247955713696222,"@ChrisW: I didn't edit because now it looks like we closed a legit question. Can it be unclosed?"
2700,-0.9568754396534492,"Your examples have nothing to do with GLn. Are the coefficients always integers ?"
6416,0.29310252299536355,"I hate to betray my ignorance but what is a self-saucing pudding?"
1986,0.10115831206163213,"Which part is inefficient? selecting an item from the table, or strings as keys?"
754,0.025861338941490158,"**I want to have something that starts with `$(this)` and ends with `.each()`**.  Is there a particular reason for this constraint (seems kind of arbitrary)?"
5756,-1.9585662395561618,"Also, I seem to be missing that GPS checkbox from the settings interface... After Review i see Shutter Sound which should be on the next page according to the screenshot above. Any clues?"
4463,-0.5072187753028635,"Your title mentions relativity, but your question body does not. Could you resolve this for us please?"
2933,-1.0065133689776713,"It might help to give some details about the problem, other than general ""it works in debug but not in release.""  What is ""it"", what is ""it""?"
1851,-0.5282567289664326,"Why not just generate the autocompletion configuration based on your YAML file? The options won't be changing all the time so why bother trying to make the autocompletion configuration dynamic?"
5559,0.8712290967650331,"@kostya - LOL. I guess we don't want this site to turn into national-enquirer.se, right ? :)"
1807,-0.3452764349427149,"In what language do you want this check to be made in? Ruby ?"
681,-0.16126494475895775,"@Vas - Should the index really start at 0? How do you indicate zero Event[""Certificationes""]?"
1675,0.23386934035517976,"Creating a single global XML would be just time harassing if I choose to save them in a database right? Do you have any link or coding example about what you are suggesting me ?"
6090,0.2050081386880728,"Surely that would mean each camera only received half as much light? Wouldn't that be a problem?"
1176,-1.6851376877662223,"I use the [full-size version](http://training.perl.com/scripts/rename) of the rename script everyday.  Why in the world would you *not* want to use existing code?"
5299,1.46335697902132,"Note that this fix is only for the US Captivate and Vibrant Galaxy S variants. Presumably Samsung are releasing this as a stop-gap until they (or the networks) get round to releasing 2.2 for those Galaxy S variants?"
5712,0.015280270573290225,"The meta topic you linked to is about Alcohol. What does that have to do with Lemonade?"
6354,0.10889815002480724,"Excuse me if this is an ignorant question but which are ""summer savory"" herbs?"
4055,1.101927541323544,"Could you please state your initial problem at what you are trying to achieve. Also please explain what do you mean by graphing interactions, graphing the different regression lines, plotting the coefficient values?"
4590,0.8854547849398344,"Also, I think it might not happen with all applications. Can you please use Banshee as the app we're testing with?"
2806,-0.2511145284936411,"What are we trying to minimize here? Number of students subject to total cost <= C ?"
3280,0.8304383669836882,"Have you tried to fully uninstall your application from your development phone and reinstall it from scratch? Maybe your database creation method is wrong?"
3006,0.6818103433319628,"Sounds like it was trying to go down the stack, but found itself going up instead. I'm not sure how that might have happenedstack smashed?"
148,-0.21324634594383746,"@Laurence Gonsalves:  Oh?  What, then, is the ubiquitous _C string_ if it is not a string?"
4527,-0.09894989696654606,"Please consider deleting your question or rephrasing it so we can answer with something useful for others. Can you link to where you got the linux 32bit drivers?"
2962,-1.3694642024525083,"""It's my own program "" - then, presumably you have the source code. Debug that?"
2722,0.1890277541847688,"Can you explain why {{1,2},{3,4}} is not ""interesting""? What is the relabeling that gives the same section?"
5663,0.7094169757858172,"Hello Arosboro, and welcome on _Drupal Answers_. May you report the code of `vtiger_portal_user_form_validate()`, which I think it is your custom form validation handler?"
5552,-0.6402762564568218,"Hmm... this seems like a chemistry question to me (and therefore quite possibly off-topic for this site). Thoughts from anyone else?"
5837,0.5009671852161295,"What R package did you use for HC3 estimation? `sandwich`, `contrast`?"
3354,-0.05039812634225706,"Do you know how to iterate over an array? Do you know nested loops?"
3623,0.4282814257268545,"Unless you have only a few big groups, enumerating all of them will likely take way too long. Could you add more details?"
2018,0.1310970886102686,"If you take a line graph on n vertices you have to select n/2 vertices, so in worst case you have O(n) selections for a random graph. Do you have any prior knowledge of the graph?"
4572,0.23465075967311474,"Bull - please try to edit your question with any answers to comments.  If using Firefox - have you tried the Add-on ""Flash-aid"" that usually resolves flash problems?"
1516,-0.2424479007391107,"and what's the problem? what did you try and in which way did it fail?"
62,-2.0886157533158727,"@Francesco: Why are you so against sharing the errors that you are seeing. Why don't you get that they are helpful?"
5389,-1.0555909003814572,"LOL the mods closed it right after we pretty much expressed our hate towards every language in existence (including English!!!)  Why are we in Software again?"
1658,-0.5057168439044503,"You created an object of class `A`. Why would a `print_r` in some instance of class `B` have access to something you changed in a different instance of class `A`?"
5942,-0.9971874802723616,"Wow, what are you doing that requires the microcontrollers to be so hot? Can't you just put the mcu outside of the hot area, maybe running wires to some sensors inside?"
4064,-0.3643811422229016,"@Tim Why not posting this as an answer? Please?"
3822,0.4692129800312503,"I've never done COBOL before, but this strikes me as strange: `IF POLI-DATE-REQUESTED-S-2 IS NOT = 11 OR 12` Most languages I'm familiar with would parse `foo != 11 or 12` as `(foo != 11) or (12)`. Does COBOL really parse the expression as `foo != (11 or 12)`?"
4907,0.20690317997619265,"Since the _\citation{}_ and _\bibcite{}_ commands are in the .aux files, it should be quite easy to extract the relevant entries from a BibTeX database.  Has no-one written such a tool?"
398,-0.23816755099763956,"Must it be dependent? Is GuiceFilter dependent on the container?"
5929,0.7954187213362104,"If it's just a matter of a few specialised custom macros, then a bit of find-and-replace would suffice, no? Or is the problem that they won't accept certain packages' macros?"
4362,-1.1796329322627763,"Career advice questions like this one are too localized for this site. Please see [Are Career Advice questions useful for anyone except the poster](http://meta.programmers.stackexchange.com/questions/588/are-career-advice-questions-useful-to-anyone-except-the-poster/590#590)?"
6482,0.357891656588872,"it works, sorry :) another question - it displays only days ago the user last seen, can i use format_date to this somehow?"
2420,0.8513620913267121,"@svante - I'm fine with that! Care to give any feedback on what I SHOULD be using?"
171,-0.778927721940815,"How do you know it's not returning a 64-bit pointer? Have you done `sizeof(void *)` to check?"
3842,-1.8591087680866352,"No matter how efficient you are it is going to take a looong time to enumerate through 2^100 subsets of vertices, and that is before you get into the fact that edges can be there or not.  Can you switch to a problem that is likely to finish before the Sun explodes?"
5590,0.29239717253865144,"With as many website/server/API driven apps are out there, you rarely don't want to upgrade. Could I ask why you don't want to upgrade, or why you want to preserve your current version?"
1694,0.2982592580954307,"@Sekar: I would expect to see that error on PHP < 5 or on Windows less than version 5.3. Can you confirm that you are running on RHEL (Linux) and your PHP version is 5.2.5?"
2070,0.09021088148508502,"In 1., is ""as id"" a valid grouping?  I.e. does the grouping have to preserve order?"
3754,-0.09350794733033607,"What's wrong with Wireshark? In general, what ""seems not to fit""?"
5262,0.6969575044075919,"Assuming for the moment that it's NOT a bug, it does make me think we could 'reverse engineer' the purposes of the different colors by shooting some test shots. What happens if you manually select a focus point, for example?"
208,0.04773153333680994,"You mean access it programatically?  Can you post some more details about your problem?"
2635,-0.685524159103751,"Why is the clause changing every time?  Why don't you post your best attempt and we'll look at it?"
6057,-0.09295500878061663,"Is your air conditioning running all day and not able to get the house temperature down to 78F?  Or is it on and off (like normal expected operation) all day long?"
2561,0.1275899904070541,"Can you provide any details about the app you are debugging? web app, wpf, winform, c++?"
2917,-0.29548515769994294,"Can you run it?  Do you have a MIPS board or an emulator or something?"
1979,0.2045541224350432,"Are the 10 websites different each time?  Can you cache the generated images to avoid generation on each request?"
4467,0.32099241276479384,"@skywaddler. Sorry, but I got to ask for clarification: In your terminology, do you distinguish between a _function_ and a _functional_ ?"
849,0.031502035881044235,"If you've got a NASM resource, it should be relatively straight forward to convert it to MASM.  Why not post a link to what you're looking at?"
6083,0.5059683778527015,"Any particular reason you're after a Nikon? Is it just so you can borrow your friend's lenses?"
4763,-0.5639154051193496,"Just to be sure, are you talking about ST as found in clinical trials, e.g. http://en.wikipedia.org/wiki/Sequential_analysis?"
2510,0.2178702826689083,"Are you after an optimal solution or is a near optimal solution good enogh? And is hyphenation allowed?"
4780,0.7646458869281494,"This seems hard and fragile.  Why not just directly address any CSRF vulnerabilities that your site has?"
5394,0.44907001057607,"This doesn't seem off topic to me. Is there a reason you decided to close your own question?"
1082,1.2006676285563198,"@bvr @chambwez I think my code is working fine now :) My last question would be, is session handling possible in XMLRPC? How do I maintain a stateful transmission between the client and the server?"
2014,0.03369182626133922,"So the size of [-5,-2] is -2 - (-5) = 3? Wouldnt [12,-2] with -2 - 12 = -14 be better?"
1764,0.35429225314482765,"If this is in production, I usually turn off all the error logging. Will the CI error handling log functions still work if I set the error reporting to none?"
4690,0.18792879674616733,"I agree, more info needed.  Is it PHP, .NET, straight HTML, or something else?"
710,-0.6872585611803016,"by js?? you mean AJAX??"
4549,0.4344263837340001,"Please be more specific. What exactly do you mean by ""hangs""?"
4208,0.16205914815924105,"The question asks how effective fluorescent clothes are during the day, and should he stop buying those tops for his daily commute. Please can you answer this a bit more specifically, rather than focusing on night time visibility?"
2899,0.3599426871268375,"Update: I have received the kit today, My friend suggested to use the onbard SD Card slot, that is, load the photos from PC to SDRAM card by a simple copy/paste, plugin the card in the SD card slot, and use the NIOS II or Altera modules to copy the images to the RAM, what do you think? Isn't this simpler?"
2684,-2.385629989238848,"Must you go through all of the cities? Must you use all of the tickets?"
4666,1.1925750277760805,"You added the tag [approximation-hardness].  Can you elaborate on how this question is related to hardness of approximation, preferably in the question?"
3795,0.08106478113027067,"Yes, it's possible. Have you tried anything?"
6478,-2.5043269751571278,"Except here is where the action took place, so here is where I questioned it. How about you answer it?"
3493,-1.3440901046230131,"why they have to in ONE page? why not use CSS sprites?"
979,0.311441509207754,"Hi Swegi.  Do you mean code other than what I posted above?"
3271,-0.07880931972510383,"I don't understand what you mean by 'all pairs'.  Say you have three coordinates (x, y, and z) such that x dominates y and y dominates z.  Is your answer ((x,y), (y,z), (x,z)) ?"
327,-1.4361613799373971,"I'm being a bit thick but what exactly is the problem...Are you getting an exception? is so what?"
5248,-0.21031656827040512,"it might not be Windows that is doing this, but your display driver. Is it nVidia?"
121,-0.5533902290562184,"I don't think there's any ""optimal"" way to do it other than just scanning the string looking for the delimiters.  Perhaps _you_ could code that yourself?"
2668,-0.17281207543526314,"What do you want to obtain from parsing? An expression tree?"
2170,-0.08812583058137702,"For a start: Is it TurboPascal? Borland Pascal?"
4257,0.004521087902668197,"I tried to edit this as best as I could, but I'm still really confused as to what you were asking. Could you please clarify the intention of this question?"
4129,-0.9571635944802896,"I've never worked with beamer `\note`. Could you please add a minimal example for your problem which compiles?"
4663,0.05706697708089925,"You can compute the convex hull in O(n log n) time. Do you mean if it's possible to do it in _less_ time than that?"
4156,-1.155903379684175,"I am not sure if I understand, it seems to me that your short answer contradicts your second answer. And, could you please provide an example of how can I use hyperref to do this?"
426,-0.0832729660064797,"@Tony: I guessed as much (do you write some of the MSdN content?), but how does it relate to the fileStream and/or responseStream and the overall solution?"
6220,0.03743223771374719,"Isn't it not invisible? Why is the sky blue?"
4971,0.8422967544343628,"I think this is off topic but I'm not 100%. Any thoughts?"
3790,-0.08593748731614116,"@BlueRaja: the distance function is only part of the problem. How do you pick the colors from the color space so that the distance between them is maximal?"
6076,-2.573647212626841,"What exactly do you want to know? Equipment tips, location tips, landscape photography tips?"
1373,0.3113855910314753,"@Kavya: It should be `twisted` not `twistd`. Can you show the code that is throwing this error?"
6030,0.7486696391795646,"What platform? PC or XBox?"
2981,0.17471356455407958,"Nice problem, although proposing a solution is difficult because the criteria for a ""good"" solution can be defined in many different ways (and since a perfect solution might not exist, you need to define a measure of quality). For example, if I come up with n-1 buckets that are all equal but the last bucket is WAY off, is that better than n/2 buckets that are all different, but within a fixed known bound of each other?"
3513,0.013167874736043571,"Are the integers regular machine words (e.g. 32 bits) or are they of arbitrary precision?"
266,-0.4637472407762221,"What exactly do you want to warn about, and what exactly do you want the message to be? How is `@Deprecated` itself not meeting your needs?"
4270,0.023292197380169653,"thanks for that, but can you please elaborate? What are the three different class types?"
5065,0.28540565432532183,"Various reasons... from KDE Bubs to Distro packaging bugs, to idk. What version of KDE 4 are you using?"
5576,0.663867380626032,"This still shows old and read messages. How do you fix that?"
1468,0.29911310616454434,"Any infos why it exists? Have you checked the logs?"
462,-0.006767727372301514,"What do you mean by no page opening, do you get an error or a blank page? If there's an error, what is it, if it's blank, are you sure your view is producing markup?"
897,0.31570768902779345,"@Jherico I've dabbled a little in COM, though I can't think of anything in there that would accomplish this. Can you give a useful example?"
6058,0.2275725440995977,"A few questions: Any cats you want to keep inside?  And, if so, is Roxy too skittish to handle the robotic door needed to keep Kirby inside?"
3721,-0.34093360550494606,"Your description of `guess()` needs improvement. Does it return `true` when you guess is less or equal to the answer?"
3873,0.4007865553636524,"Which debugger are you using? Have you tried the script debugger in IE8?"
49,0.7480176672982725,"I don't understand what's wrong with the standard C pre-processor. Can you clarify?"
763,0.4936437705876096,"You have Firebug? Is it reporting any JS errors when you load the page?"
2054,0.3241353610414495,"Can you add some sample code here?  What is the type of the exception being unhandled?"
1210,0.3432106565693868,"I got the representation part. But what I want is how to convert this huge monster output to the neat output like this [(1,2), (1,3), (1,4), (3,4)] ????"
5790,-0.7203960590794835,"Perhaps this is best seen as a way to structure the design of a large-scale digital circuit (just like it might be a good idea to use subroutines in a large-scale computer program), and not really as a formal lower bound? (Chapter 14 of the book that you linked has plenty of Theorems with Proofs, but they seem to assume that you follow certain principles in the design of the circuit?)"
5050,-0.06683329101383337,"I've removed the reference, but if you are attached, you can put it back. Can we remove these comments?"
480,-0.9035518547417002,"What is the purpose of knowing if they are using the computer or not? What happens if they are not?"
3371,0.8535910599407339,"How sparse is the matrix?  Does the matrix have any special shape, or relationship between entries?"
280,0.7535363343324339,"We still need more details: do you have your own SMTP server? Or are you using a gmail acccount for instance to send your mail through?"
3376,0.2493805024657326,"Why does it need to run continuously? Is the data changing?"
4228,0.17994204586871052,"__In a Linux kernel context, the only lock with a spin implementation has a mutex interface.__ I dint understand this line. Could you please expand on it?"
1368,0.3588239642940057,"Which math library are you trying to use? What exactly is going wrong?"
2957,0.4036166777937492,"Find the shortest path.  If there are other paths of the same distance, find those as well?"
4380,0.3240629698096213,"DRM in eBooks is driving me mad.  Can we please please please hurry up the free market on this one?"
1547,-0.6079495148937706,"What is the question? What is wrong with it?"
6393,-0.5629258744506848,"1. what are your pedals and why such pedals? 2. Any idea what load an aluminium bike can stand on touring?"
1607,-0.469249436169979,"Most of time such a question is a sign of bad design. Why do you need dynamically assigned variable names?"
4356,-0.19140811059302856,"@Stephen Oh, sorry... I misunderstood. (but u do see why u need to learn c /c++ right?)"
3288,0.09285578485279852,"usersmarvin, certainly there is a strategy that always works: ""enumerate all possible selections of vertices, choose the smallest one that satisfies the condition."" Did you mean there is no *polynomial-time* general solution?"
5492,0.27211744975701685,"I always try to use correct grammar.  Why dumb down your correspondence?"
662,-0.053121665637018395,"mozilla orders events differently to IE though doesn't it? I assumed my way didn't work because the clicked element will process the event before the document in IE?"
1774,0.21294783262652656,"What is it you are encrypting with mcrypt?  Is it a serialized session from `$_SESSION`?"
1372,-1.7222997139014538,"That's what groups are for.  http://docs.djangoproject.com/en/1.3/topics/auth/#groups Why aren't you using groups?"
1467,0.7520113385973157,"Can you let us know what error you got or in what way its failing to load. Also can you copy&paste a NSLog output of the full URL String for both the | and the %7C version of the string?"
5185,-0.04648018637340422,"OK @Juan - the meta question has established unequivocally that questions like this are definitely allowed. Could you ""un-close"" it now?"
522,0.7416500095728422,"@Jon Skeet @Brain Rasmussen I apologise, they did not appear on the 'related questions' nor on my searching. @digEmAll I'm somewhat new to C#, couldn't I use the second one if I used a nullable Bar?"
5589,-3.719464944601613,"Phones generally don't even ring for more than 30 seconds. Why do you want to do this?"
486,0.9206794705679434,"Can you clarify the question? Are you asking why member variables must be declared outside the scope of a function, or are you finding that your constructor isn't working as expected?"
5978,-0.210260279718936,"Harmless for them? Or harmless for you when they come find their revenge?"
4175,-0.007922925919280099,"@Yiannis: Sorry, I don't understand what you mean. Would you provide me an example?"
1964,-0.13062174187885955,"Maybe, but it won't be any more readable. Why do you want to?"
3718,0.28561770915149953,"@RoBYCoNTe: I tried to uncheck ""ASP.NET"" in the ""Debuggers"" section but it didn't change the behavior. What else should I check?"
6307,-0.8678140245049714,"@Aaronut Can't someone do this besides the OP? Don't we have some sort of mod people?"
917,0.2515929820760654,"@cantrem: Yes, that's what I meant, just a direct rebuild after it fails. What happens if you change any other line and try to recompile?"
899,0.28062721654402173,"Have you verified the content of `file` is what you think it is? (Via debugging/Log?)"
6038,-0.008993643332798795,"Can you clarify ""guy in a tube""? Like a tube raft?"
1904,0.10440856753219914,"It strikes me that in your debug output, you've carefully converted things to strings, but you haven't done the same to XXXXXX.  What happens when you change XXXXXX to XXXXXX.to_s?"
