id,label,text
2760,-0.2370708015160635,"Yet another question: one of the frames from your example gif describes a route that is not really a simple path (this one: http://imgur.com/0vjvr.png). Are that kind of route (or rather spanning tree) allowed as a valid solution for your problem?"
3954,-0.020775346652398063,"Define brute force. Ar you OK with iterating all values of `A` starting from 1 and trying to find `P` in `O(1)` for each of these?"
4249,0.2862152178940616,"I don't see how thinking of raster as a specialised type of vector is helpful to understanding. Could you please elaborate on how this perspective has helped you?"
6370,-0.6874693579224538,"I was under the impression that higher temperatures caused even more carcinogens. Do you think that there's no point in trying to keep the temperature down?"
6182,0.6792419279723896,"hm, can one award a bounty to a ""question""? as in ""reward the author for this awesome script""?"
5832,-0.8024340740204998,"Also do you have access to the underlying data? How are the curves drawn?"
1544,-0.3664938342403909,"@S.Lott: No, I'm saying that looking up the function is far from easy if the obvious search terms don't readily yield any insights. Am I missing something?"
6158,0.09245487715108484,"Are your links stuffed on purpose?  Your CodingHorror link points to couchdb.org?"
26,-1.1215481705009034,"I'm always amazed at how many questions are similar to this. Are people itching to write code like this?"
396,0.16629970919846582,"@arthur: Added a more concrete example in Java. How would you accomplish the same thing in Clojure?"
2960,-1.3847055626788043,"This question, while not an award-winner, is at least much more specific. How about we close the *other* one?"
6106,1.0548328585306164,"bring what back? how are bluetooth and killing processes related?"
4091,-0.5721110917886174,"Can you please elaborate a bit? Like write few-word intro to those algorithms?"
224,-0.2424373603612565,"Are you aware that such an app requires root permissions (because it needs to access the sdcard raw without filesystem)? Therefore it will only work on rooted devices?"
4388,0.24668062307474595,"Sorry my browser can't load the page to the book. Can you mention the name?"
4398,0.8098328915289859,"I know that ""click here"" should be avoided, at least for semantics. Can somebody please explain ""It ruins a perfectly good SEO opportunity""?"
4403,1.7485041390144065,"I don't understand how a folder-based file system is not a hierarchical system. Could you please explain further?"
6332,-0.12700028852398534,"Out of interest with the cutting down on sleep do you think that this is sustainable longer term?  When you say your other half works part time, how part time is that?"
941,-1.12184102184697,"@Monish If you don't know how to implement modes of operation, you shouldn't be implementing your own crypto code. Why not use an existing library, like KeyCzar?"
3395,0.182135329408485,"What kind of `N` are we talking about here? i.e. what's the maximum number of bits to sort?"
616,-0.5023568076443681,"Aha! Can I also give you an answer which is not coded??? You and me need codes... Okay?"
2856,-0.07924996387534262,"OnDrawItem sounds good. Why could you not get it to work?"
2137,-2.478283579453796,"@pimvdb, No I don't. Do you have something which could lead me to a solution or just wanna make some pointless comments?"
2270,0.03680729261684079,"Since all of the balls have a box to be put in, all organizations have the same point value, right?  Or am I missing something?"
4305,0.10281589937122312,"What do you mean by _if i don't use a custom menu_ ? Could you please describe more clearly under which conditions you get desired result and when not?"
6246,0.3454644565576003,"So does jail breaking an iphone consist of changing file system and directory permissions or is it more complex?  If so, does anyone know the low level technical details?"
4264,0.20243162601391576,"Moving the cable around and such I have not been able to spontaneously reproduce the issue, however it is happening a bit less frequently now... still annoying though! If this question is better placed in SuperUser, could someone move it please?"
6309,0.05984057565183192,"As a college student, what gear do you have available?  Just a hot plate, or an oven, microwave, etc?"
5629,-0.7718960331896683,"This question does not seem to make sense. You say both ends are routers, so assuming you set the routes correctly, and the routers are gateways, what is the question?"
4213,-0.044096670124999335,"Sorry, forgot to prefix your name. Also, is there some reason you are not using yum or similar to do the installation, since it does dependency handling?"
1300,-0.3614510873928489,"What's your question? Do you want to parse the entire record, understand the format of RRULE lines, something else?"
4883,-1.2293526746088148,"You also seem to have 'Web' there twice. Which browser are you using, and do you have any greasemonkey scripts or plugins which may be breaking the links?"
456,0.021066066110873704,"What kind of files are we talking about? Can you elaborate what you mean by ""hardlink"" in this case?"
2321,-0.7009544613404539,"You made me work at that a little too hard.  Next time, could you provide a link to the algorithm that you're using, or at least give us the name of the algorithm?"
956,0.03966997711011061,"So putting them in separate declarations is fine? I mean can we actually use auto in anyway inside a struct like I showed in the example?"
2180,-0.5981208648251044,"@Vlad: then why is there a problem? If you make each tile say 5 bytes (that 1 byte + entityID) and every entity contains it's position, then everything is O(1) right?"
4499,-0.026675507502836537,"I get confused about scope with this horde of niche sites.  Please explain:  A question about apple filesystems belongs on superuser?"
5099,-1.1090297809284044,"For me, there's a fairly large gap between 'a web map' and a 'web-based GIS': a simple map with layer control and panning is great for many applications, but doing analysis through the web is a different scope which many web maps don't attempt to solve. Are you interested in doing analysis or primarily display?"
1907,0.4456982109861229,"what happens when you type, for example, `git` on the command line?  Or `which git`?"
3303,0.39945805510166704,"I have tried outputting to other formats with no avail.  Could you elaborate on what you mean, ""the links to the pictures are broken""?"
3273,0.16140550963271255,"Is this question about building a notification system for a 3rd party site, or one that you own? Do you have access to the internals of the site itself?"
4142,-0.4027008062104236,"I am not familiar with the desired formatting. Could you please add an image of (or provide a link to) some example of what you want to achieve?"
6249,0.043147175082323436,"Duplicate of [Why does my computer freeze when I unplug my headphones?](http://apple.stackexchange.com/questions/828/why-does-my-computer-freeze-when-i-unplug-my-headphones)?"
2272,0.1969535414448368,"what context would the serial number be used in?  Is it just an identifier or is it meant to be a secure type thing (like the Windows registration key)?"
1882,-0.14670337429436794,"I find the documentation for Net::HTTP pretty hard to navigate and understand compared to curl's manpage. Is there something wrong with trying to delegate work from a Ruby program to another unix program?"
6145,-1.1283202035336768,"@BioBuckyBall: Do you read what I wrote? Do you read every word?"
4426,-0.18858497905268665,"I'm sorry, that doesn't really make sense.  What is your question?"
566,0.06131297521100234,"@Eric - Sure, it mitigates it to an extent, but why start with something insecure when it's just as easy to use something more secure (i.e. same code, just swap out algorithm name)?"
3131,0.7401987377604476,"Do you have any code we can look at? What have you tried so far that isn't working?"
5498,0.15251127527286373,"+1 ... even though I know where it comes from - see the mmyers answer - i've always wondered why it's considered so compelling. Can anyone add to the mmyers answer and explain?"
5172,0.029508002211571568,"The comments on the youtube mention that the framerate is too low to play the game comfortably. Why do you want to do this?"
1104,-0.3291476962315508,"Im surprised nobody has talked about Perls *Easter Eggs*.  Isnt that hidden features are?"
6173,0.743644273164002,"@conmulligan  thanks for the heads up are there any plans to let people login ? slos I noticed that when i searched a tag and and selected it i got old topics that had new answers first rather than just the newest topics is that intentional ?"
760,-0.5556889587857796,"What's ""Web of Knowledge""?  Where is this ""javascript form""?"
3498,0.06977222514507178,"Loading it into a frame also seems to work for me: http://testing.subdmedia.com/loadinggifframe.html. Can you post the full code for the iframe as well as well as the content, or better yet, a link to your test?"
1808,-0.2090761828673597,"Why do you use mysql (2.8.1) ? I think you can't use both for one application, do you have this 2 gems in your GemFile ?"
3801,-0.891505567743055,"@aaa: what would be a general way? I mean how general it can get?"
4914,0.7118058208163751,"This question isn't really on topic, in my view. It also might induce a holy war, along the lines of ""vi or emacs?"""
2776,0.8328424333714848,"Wouldn't the time complexity depend on the type of tree? Could you elaborate on that point?"
4154,-0.7248432007706348,"arg, sorry. I was fiddling around with item formatting all day long I started to believe you can't use formatting in item[] at all... Should I delete the question?"
3067,0.022558877159030755,"is there another transparent view in front of the right 1/3? Or maybe your button has been moved outside of it's parent view's bounds?"
2895,-0.13380031979864174,"Did you have a question about ""Question 1""?  Do you understand why the answer is 6?"
4633,0.2613150676072973,"I am not sure of the question. Do you want problems that are obviously in one of the classes but not the other?"
1103,0.4784863670340728,"It would be helpful to learn what types of helper functions you've written.  Do they lend themselves well to a Term::Menus approach?"
4159,-0.6888683533381696,"There is no need to swallow initial whitespaces of lines; they are ignored anyway. Can you please edit your answer accordingly?"
6358,0.07234271562288398,"Can you explain what you mean by ""base""?  Do you mean the crust?"
2883,-0.5055476364844589,"Is your problem that you don't know why the cost of the cycle 3 -> 1 -> 2 -> 4 -> 5 -> 3 is 37? Or is it that you don't know how to do the backtracking?"
5271,0.3402684394316056,"@fmark: Good for you. Why is this comment (from a thread that's now 3 months old, no less) directed at me?"
890,0.3843129869586451,"What kind of representation are you using? Adjency matrix, adjency list...?"
4740,0.12916608772791646,"Kolmogorov test is for distributions hence object lying in infinite dimensional space... not obvious to get asymptotic power=1. t-test is about testing the mean of a real valued random variable?"
4539,0.1945130974020536,"This shouldn't be happening. Could you please [file a bug](https://bugs.launchpad.net/ubuntu/+source/tomboy/+filebug?field.title=Another+Tomboy+error+while+tring+to+sync+with+Ubuntu+one)?"
5601,-0.4767538302165585,"Hmmm, Apple software on Windows question. I guess the ""Apple Software"" part defines the fact that you posted it here?"
6466,0.6513881161399582,"wow, thanks! combined with baffledcook's tips this basically covers everything not covered by experimentation - would a lasagna freeze well? my guess is a definite no?"
5327,0.5484856624786933,"Matt H's comment covers the ""how"".  As for ""Is it legal?""..."
5419,0.9060372583811482,"I like the close votes with no explanation. How is this not a real question?"
793,-0.6862136263204042,"How is it awkward? Which version of VS (they have different levels of js intellisense support)?"
4002,0.3852187936863759,"""Debug"" and ""Release"" don't have specific meanings; they are just ways of referring to a bundle of options, which could be different in different projects. Do you mean whether something was build with debugging symbols and left unstripped?"
5324,0.17259883199787796,"My Galaxy S on 2.2 shows all the letters, hmm.  So you actually have contacts that start with those letters?"
788,-0.10215263922569827,"Only VideoCode returns undefined? Have you tried not using capital letters?"
5788,-1.4864939090896294,"do you know any good references for the special cases of nonexistence that you mentioned? Or perhaps, just a general reference/set of references for the order 12 case?"
1291,0.17708190292558426,"Have you tried to run it without the `sys.stdout.flush()` under the loop? If so, what was the result?"
5151,0.184133732257019,"Yikes.  We didn't ever really get a satisfying conclusion to this one did we?"
3306,0.07816965025823884,"@Nate, ORDER BY will only sort the result in a specific way, not really related to this.  Unless I'm missing something?"
2062,-0.08593919079488894,"And in what form do you have that number? string?"
4752,0.20670367542057255,"I am not an expert but I found the sentence ""controlling for associated subscores when devising cut-off scores on each dimension of a measurement scale"" a bit esoteric. Can you give me one more line of explanation (otherwise I found it difficult to understand the question) ?"
5033,0.3696393118387915,"This question is a forum-style post, asking for multiple answers. Perhaps ask for the method that does the best job, or requires the least effort?"
713,-1.3875525158411035,"Do you want the complete question solved yourself? What exactly is the question here?"
4744,-0.2796434467607871,"if your series is non stationnary, the ACF will decline very slowly, to the point of being useless (it essentially a constant). What do you mean by 'have any meaning' ?"
5280,0.8314212091300208,"I haven't used photoshop in ages, but that seems quite large. Do you mean the size of the files on disk, or do you mean the memory footprint of the file when you're working with it?"
2937,2.6430577100748134,"Thank you very much for your comment! Could you help to mention an example of debugger helper?"
1845,0.38567826329876503,"Weird thing is that setting ENV in environment.rb was ignore. That should overwrite system globals, right?"
1941,-0.3823848444848103,"What exactly do you mean by tab-completion? Do you mean juts completing the commands available or completing the list of gems to install?"
5428,0.18174627163046875,"I've done a PHP wrapper but don't have enough reputation to edit it in. Could someone link to it?"
786,0.2840938651887017,"Could you provide some sample code? On what elements does this actually happen?"
4392,-0.08307894674218726,"@Slawek - Please provide some documentation for your metric.  Can you find anything online to support that?"
2457,0.3119240497933273,"""1 to over 200"" - what's the actual upper bound? and how big are the cards, normal playing card size?"
3512,-1.2704439651837343,"bit or digit? the title of your question says digit, your question says bit, so what is it?"
5727,1.5693452469612503,"It depends on what you are cooking with the egg, because they have a few different roles in a dish. Can you provide more information on which dish you are cooking where you want to replace the egg?"
3681,0.5535295096475863,"I'm not quite sure what you are trying to achieve. Do you want the background image to change only when you hover over the corners?"
5562,0.04603401379485191,"What do you mean by ""solution"". Do you actually need stationary states?"
544,-0.71512857309089,"What do you mean? exact practical view?"
63,0.5456086964950744,"Let's talk about the error in a little bit more detail, Sergey. What is the output you get and what is the output you expect?"
292,-0.5003185555144201,"Well, you're ignoring all caught exceptions. Is an exception being thrown?"
4204,0.5888572218031791,"This is a big discussion (""Neil said..."") and then a small question (""Please, state the stand and then its advantages."") A better question might be ""What's the best kind of kickstand for [lifting the rear wheel / loading groceries / etc.]?"""
114,-0.1006326720185889,"What OS? Can you establish a link local IP address?"
5376,0.18393882174856188,"Adam, I am not familiar with buddypress but I think you can normalize the query quite a bit using joins (and  avoid sub-queries all together) which are  more performant. Is there any technical requirement for your sub-query approach?"
977,-0.6176232579687735,"Its not ""really"" fast, it just runs at a normal rate. Ever heard of the saying, in the land of the blind, the one eyed man is king?"
6189,-0.2820119003716054,"Could you try to render a case-use of the jussive mood from another language into english? As in, how would you use the imperative to command he/she/it/them separately from the second person?"
883,0.7714361828454224,"""I'm not sure what the most efficient way of doing this is.""  Try both and see which one is faster?"
2829,0.3804153565356726,"It looks to me that you don't simply want to combine them, you want them to be merged them together evenly like a zipper or cars politely merging on a highway. Am I correct?"
2651,-0.058837716200505014,"Exactly! If I am to implement another interpreter using R, do parsing tools exist?"
5449,0.21159108824186385,"a real story to define this concern: I have an app that is working on data from api.stackoverflow on one thread while working on data from api.stackapps on another. Should each thread have a separate throttle or should they share a common throttle?"
3326,0.182135329408485,"What kind of routing logic would you provide at the host-level?  Are you talking about routing to various servers in a pool, or using something like IP source-routing?"
6183,0.2150151263059505,"Quick question... when you define a custom command, is there a way for it to receive arguments? For example: `'/dosomething arg1 arg2'` ?"
200,-0.2759657059184658,"Annotations aren't executable code, so this is unlikely. What are you really trying to do - in what conditions would you want a test to be run or not run?"
2203,0.13936035759017268,"Were the name lists lexicographically sorted? Will the corresponding hashes still be sorted?"
4396,0.5871994115009361,"-1: I've read that book too. Can you please be more specific about how the message in that book addresses this question?"
5719,0.11621397420815065,"@Lord Torgamus: Yikes! Word your question imperfectly and expect it to be closed mercilessly?"
995,0.10527986732185184,"Where is the call to the child's function? (Did you mean to put a function1() somewhere?)"
627,-1.8995928542656175,"You could try telling us what the errors you are getting are. Or are we supposed to guess?"
4906,0.14816319292640318,"I'm not seeing that behavior. What browser are you using?"
2719,-0.6624458049368885,"@BoltClock: I'm pretty sure that algorithms are part of the ""programming"" subject. Strictly speaking an algorithm is not a program, of course, but are we really going to throw out all the questions on searching and sorting methods, on the grounds that ""quicksort is an algorithm, it has absolutely nothing to do with programming""?"
4498,-0.903975565223534,"The file was indeed locked. Could you please expand on how to identify the uchg flag in the ls output?"
4013,0.2209307868077767,"(1) “Transitive closure” sounds as if you are looking for something like R∪R^2∪R^3∪…, but I guess that this is not the case and that you are looking for the H-representation of R^k for a given k.  Am I right?  (2) Sorry for my ignorance, but what is an open polytope?"
5222,0.4550660209017468,"'prefab' really isn't a particular architectural style...it's a manufacturing process. Can you post a picture?"
1588,-0.3080847237161343,"Zakman411: Naming a new, unsaved document untitled is the correct way according to the HIG. http://developer.apple.com/library/mac/documentation/UserExperience/Conceptual/AppleHIGuidelines/XHIGWindows/XHIGWindows.html#//apple_ref/doc/uid/20000961-CHDHBCGE Why do you want to violate that convention?"
360,1.2160822008884102,"Thanks, I forgot to add this . Where shall I add it in the list ?"
1480,1.594325844230864,"@Nikolay O. : Thanks for your input. What exactly unbrekable space character means?"
2882,0.2249414093897424,"Where abouts are you going to be coding the Parser? In excel?"
6410,-0.8211362463970332,"p.s.  why would having more molasses make it hygroscopic, I thought that meant water-seeking.  Wouldn't the drier ingredient absorb more water?"
6439,-1.4431371391256278,"Why do you want to cook fish for someone who doesn't like it?  Why not just give her something else?"
6315,-0.008421119750670664,"Are you limited to using a microwave? Or is that just a preference?"
205,0.0014745772205570606,"Is there a specific question you have?  Or were you just looking for a code review?"
351,0.7040764357791114,"Please explain why you think the `ClassNotFoundException` is incorrect. Possibly even share some code?"
4164,0.4637923374163818,"Thanks! Example of using breqn in my case please?"
5467,0.1266122436010037,"Nice, but it overlaps notifications. Could you move them under the sticky bar?"
2790,0.21385248429898093,"this question is getting flags. Can you improve it or make it more clearly a *question* please?"
950,0.2592059830354036,"@Potatocorn: Really? Good heavens, on which platform?"
3875,-0.026378141972626112,"Ok, now you got me. Where do I get the stack trace?"
5118,0.3454396013741949,"not sure I agree with your premise, most of the open source raster software I'm familiar with stores data in files directly. Are their specific features of Image Server you're interested in?"
4929,-0.026539825153354964,"Seeing this problem with a bit of perspective, an idea would be to embed bibliographic metadata in PDF files. Maybe biblatex can do that or can be made to?"
2107,0.2160033693571773,"The array is always sorted ? `1 2 2 2 3 4`(three 2) will return `1 3 4` or `1 2 3 4` ?"
2842,-0.285084264364878,"At a glance, I can't see anything wrong with the code (I have an app that uses UIImagePNGRepresenation the same way you do). What exactly is going wrong?"
2832,-0.05294510348402043,"Which shell? How have you tried to do this so far?"
6265,-1.2144188717317532,"How are the printers connected? Via network, or via usb?"
5847,1.0123968505104508,"What type of device will be doing the dropping?  ASA, IPTables, WFP, ect?"
3789,-0.37778551228689017,"And can you see how he treated multiple people in the comments section? Or does it not show that?"
416,-0.6158821143162576,"Your code isn't going to work anyway. How can `tags` contain a new instance of the tag object?"
5206,0.520455078929365,"Great question, I'm really curious about that also. Any mechanical engineer types out there got a good explanation?"
5876,-2.0355754538266333,"@Ranieri, what would you suggest? JSON?"
3118,0.1622029506408386,"@Trip: ""I want to put an image on an element after a section which is some width. How can I do this?"" :P"
6187,-0.4547868436969456,"@Edward can you be more specific about what these three terms are supposed to refer to?  Do you mean the machine running the software, the business that provides you the machine, or something else?"
3766,-1.1435653310027474,"Don't you think that ""What do you miss?"" kind of questions are subjective?"
1041,-0.6859978347355846,"Track users? Keep statistics on what?"
3904,-2.1315465128068367,"And what operating system? and why on earth are you writing this in assembler?"
6353,0.7780710655551062,"I've never heard of this; it sounds really interesting though, and I'd like to try it next time I make meatballs. About how long does it take to cook them this way?"
919,0.11938166735277535,"What is the `ArrayIntStorage& AIS` parameter?  Is it relevant to your question?"
4542,-0.4074016966624183,"We will need more information. Would you please open a terminal and post the result of ""sudo fdisk -l""?"
1478,-0.004763889428696077,"I don't understand at all. What is ""link a certain image in my project to a certain page""?"
4113,0.15030833019123033,"Thanks but I didn't quite understand the response. Could you please elaborate on it?"
1202,-1.6121626231020714,"Who would be helped by this?  Is all that work really going to help someone?"
5850,0.08762882477419716,"How do you know its a proprietary format? There are several 'standard' file formats - perhaps you could provide a link to an exported (public or self-signed) certificate, then perhaps people would be able to see for themselves?"
661,-0.04706534650911025,"Well, it would depend on what the text file contains! Basically, the compression will be removal of extra spaces and line breaks, which can decrease the file size substantially, but how will you re-construct it again on the client side?"
4032,0.2856363445154243,"Despite the good answers, this is still a REALLY poor question a) because of the lack of information and confusing wording b) because - depending on what the question actually is - it's unlikely to be of use to anyone else. Can someone with edit permissions tidy it up ASAP, please?"
3282,0.5574952143975213,"You say we are given a set **S**. Can we modify its contents, while still providing an answer relative to the original **S**?"
2060,-1.818304071946233,"Sure, we tell you some good ideas, you make mad money.  Are we suckers?"
1924,0.15832816018655702,"Version 1.2.0 has now been released: http://www.redmine.org/projects/redmine/wiki/Changelog#120-2011-05-30. Can you try that instead?"
1816,0.18427141697850388,"I don't see ""parent"" at all. Maybe it exists in your templates?"
1512,-0.0615116669214961,"Can you restate the question? Do you want to display future events on the system calendar, or do you want to get the future events from the system calendar and display them somehow?"
