id,label,text
235786,1.3013973262740386,"Hi there, thanks a lot for commenting. Just to be absolutely clear, and avoid anybody misinterpreting your remarks, could you say if you prefer version 1 or 2 of the lead?"
397366,0.4491020902118301,"Hi, I reverted vandalism on a couple of your subpages that you transclude in your main userpage. Do you want me to semi-protect them (your subpages) so that it is more difficult for vandals to subtly vandalize you?"
134055,-0.14228031286491608,"Vaguely connected, because I don't feel like starting a new section. Have you seen <url>?"
594083,-0.16480281895047705,"They come with cheese, come in beef, chicken, and pork and are full of fiber. What's not to like?"
290781,-0.3611110886061461,"Hi, I was looking through <url> and noticed that the Gaza article has been on hold for over five weeks. There doesn't seem to have been much discussion on the talk page in April, so what's the status of the article?"
185351,-0.32925719795395625,"That is the standard ARBMAC (Arbitration related to some Macedonian and other Balkan countries) warning.  Still interested in accepting the deal?"
477181,-2.122328030387186,"You won't even let the ink on your report dry and you're already at it again. Care to explain finally what about the DAB needs ""cleaning""?"
496654,-0.4242629025470368,"When I find 20 sources calling an Individual Armenian including TURKISH, the NYT and Time's article are presented in a dubious manner, how can I bey considered aggressive? It is the duty of every editor and admin to weed out Original research and dubious citations, no?"
606883,-1.2694699975632886,"Alright then!?"
132482,0.1469771115648856,"I removed the hyphen from ""oldest-known"", which is hard to see if you aren't looking for it. Does that answer the question?"
624518,0.2905360936871075,"Thanks, I've PNG-ised these, and they look quite a lot better (to me, anyway!) &mdash; ""cbc decryption.png"" was missing; I don't suppose that's easily available, for completeness?"
621247,-0.43265607018059293,"These events are fictional. What real-world information can there be about them?"
572728,0.012745835972281985,"Hi, I see that you agree that User:Dr Joe's edits are suspicious... his latest edit totally clinches it though, as he went to the article <url> and reverted my changes on it, exactly like Beckjord did one or twice in the past out of nowhere, and then made edit comments on his talk page and talk:Bigfoot about how ""my"" mythology article sucks and needs to be opposed. I was wondering if you could go undo his edit for me there?"
204605,0.524280035923336,"Can you respond to the comments I left on the S&M PR page please. If you are satisfied with the changes, can you tell me if it is qualifiable for FAN and if not for FAN, then for A class status?"
119507,-0.2962908528073706,"pa ne vrau0107am se ureu0111ivanju u010dlanaka, jer mi je dosta da se raspravljam sa svakakvim budalama, ali pou0161to vidim da moje mape ni posle 2 godine niko nije dirao, onda se svakako vrau0107am crtanju mapa. a kakve mape misliu0161 da treba nacrtati?"
551872,-0.13573774456721188,"Splash I added the info about his age dispute, the user then removed my edits, called me a liar and added a whole bunch of other deliberately negative POV edits to the article. What can I do now, can they be blocked?"
500465,-0.19473280078153404,"I'm changing over to your Rangers idea. Any way we could get a fairly obvious link to 2006-07 season page on the main <url> article?"
624879,-0.07945776048656845,"By the way the list schools was in wikimedia code. Or is there another way it should be done?"
625400,0.2308514143085911,"Make that ""copyvio tag"". OK if I revert under those conditions?"
331685,0.4282707688015912,"Well then, if that's figured out, everything is ok with me. When do we start?"
114396,-0.012116119373212872,"The placement of the hyphen in ""Ekur-huleni"" seems odd: as far as I know ""rh"" is one sound in Tsonga. Maybe ""Eku-rhuleni""?"
149992,-0.4459144181870409,"Hi, sorry I think I'm missing something here. Why are you adding a red link to the vandalism page?"
619157,-1.5402543282370234,"Hello???  Are you just pretending I don't exist?"
628845,0.2486679190551297,"Here's the FFD page: <url>. How do you know that the photograph was made pursuant to a law or ordinance or in connection with the transaction of official business?"
627108,0.6632907035950188,"Yes, but not for long. How are you?"
483632,-0.2290940536107147,"Were you aware this guys was publishing private phone numbers? Even though it's an IP, do you think something longer than 31 hours is warranted?"
578470,0.7102681987430925,"Thanks for your reply. So just to clarify then, you are happy with the number of references, but you just need me to convert each of them into ref/footnote format, and then the article is GA-ready, is that correct?"
607143,-0.010459738108120342,"I agree it is a bit hectic how active the conversation is. Would you like to take it to #wikipedia ?"
97514,-0.4685082038749305,"Where should he be? As a parent of Isa-Beg?"
550420,0.4890346065389227,"Over at <url> you've changed my request for protection on <url> to a request for unprotection.  Is there a reason for that, since the page has yet to be protected?"
489092,0.02777670550915089,"You deleted this, but somehow it still shows up on the parent category's page <url>.  Is this normal and/or can you fix this?"
621291,-1.312010417337813,"Why do you ask me questions to which you already know the answers? Is it a rhetorical device?"
607362,-0.9111597914359268,"Email checked and responded to.  If you can't respond here, could you at least leave me a note to check my email?"
548991,-0.4458497080072755,"And what about <person>? Does it need fixed now too?"
329098,0.5722112072221046,"Would you be willing to do another pre-FAC review of a different article for me?  Specifically, the ""John J. Tigert"" article?"
252195,-0.2390391278163063,"<url> is a bit of a stretch. Do you think you might strike it?"
330394,-0.0562431068456275,"Did you see the edit by Marrtel - <url> - to <url> ? Is that a reasonable change ?"
629241,0.9838586317773456,"I'll unblock you if you give me some confirmation you've understood this and you are prepared to discuss the article through the proper channels, calmly and politely. So, cool down please, okay?"
34026,-0.06393641892443551,"I noticed you reverted a US English speller.  Shouldn't the section <url> actually be spelled ''Tyres'' for internal consistency?"
454734,0.33113931678391734,"Thanks. Can I save your last line as ammo in my next edit war?"
452850,-2.2512196473073915,"Wow, you waited a whole ten minutes. What's the problem?"
153636,-1.5973411641865003,"I clearly provided a source that is valid, and yet a couple of hours is a big deal? Is it your way, or the highway?"
627249,-0.07715444998689072,"If you feel you have a solid case, you can report it <url>. Just out of curiosity - can you provide a few examples (with links) of this behaviour?"
157383,0.9965376300377964,"Thanks for that, hopefully I have input this correctly. This page also seems to be flagged due to several issues, surely these can now be removed as the page has proved its worth as much as pages like <url> have?"
83635,0.3803414054704931,"The SNL encyclopedia article says ""M/S Palatia"", while my book source says it probably was a steamship (with a note saying that their sources differ). Do you have any more details on this ship?"
406639,-0.02012912579132445,"Your recent post to the straw poll at <url> may need some clarification. Did you intend ""support going to Arbcomm"" to be a vote for the ""Death"" entry?"
192617,0.32802370331752734,"I wouldn't know where to put it. I know Record Charts is for charts etc and the certifications but where would I put a discography question?"
348100,0.7355271047694107,"Hi, I'm new to RC patrol, and I was wondering how you do the 'reverted edits by X to version by Y' edit summary. Is there a shortcut to reverting an edit?"
78933,-0.7769369224741403,"Re <url>: I reverted once. Shouldn't I get a cut of the proceeds?"
106262,0.20232882453530107,"Mmm its a little difficult to see on the new one. How about the one on the right?"
178477,0.29154508068202645,"Hello, I'm just wondering how you have found out all the birthdates for the Coronation Street characters? Does it say somewhere?"
455392,-0.4391194528433279,"I'm with you - it really is a friggin' pain that people refuse to read no matter how big you put the text.  Should we just maybe remove the source entirely?"
620852,0.8906624988100106,"Thanks! =D And how soon are we going to try to get The Lost Age to FA?"
888,0.3094776246354083,"Thanks for the heads up. He doesn't know any english?"
621527,0.392348057085894,"I will endeavour to be (cant think of antonyms) non-combative and kind. Will you give me a particular example of what I wrote and what I should have written?"
123811,-1.3876263021881257,"original article????"
620599,0.6132375038795398,"Another admin has already deleted the article. Do you need me to restore it for you?"
201198,-0.29412602055981835,"Question: how do we move the content from the existing page to the new page?  How do we reference the space to the new page?"
619951,-0.4002885077574721,"Are they here? Who?"
555962,0.690815493856506,"Great- so bump up to around ten selected pictures (selective choices, obviously) and then you feel it is ready for FPOC? Is there anything you feel the portal is obviously lacking?"
201981,-0.9713154177310894,"Corrections, make that four terms: I pick a car and swap, I pick a goat and swap, I pick a car and do not swap, I pick a goat and do not swap. Who cares about doors or door numbers?"
619754,-0.5894068512746862,"Back on topic Jigglyfidders; I totally agree with Deconstructhis on this one. What will you do to address this issue?"
488320,0.2823261241977911,"Hi, we worked on a few Australian-related articles together. May be you want to make a look on my <url>?"
178278,0.8394988265717125,"Hello. I was wondering if any of the books you have can shed much more light on <url>?"
39881,0.4562071725785797,"This came up for discussion on <url>. What is the last word on it?"
630067,-1.4545264461300138,"You told me that you couldn't access the page in question, although I had recently changed the link to its new location. Maybe you just didn't bother to check it out?"
600844,-1.1501313143924616,"During your RFA you stated that you would be helping deal with the Scibaby situation after Raul stopped doing it. Do you feel that you've done what you said you were going to do?"
471390,0.14070271443812674,"PS. Is <url> more relevant to explain the analogy?"
167022,0.6979019119957506,"The PressTV references in Wikipedia's ""Turkey-PKK Conflict"" article are not the same, but the titles are wrong.  If you have time, can you correct the titles?"
557380,0.4128039420272301,"Thankyou Fail, but the template I want is the one that goes at the bottom of the article and produces a message that goes something like 'This article is a copy of the (X) article in the German wikipedia, version 21 December 2009 10:04.' What is that template?"
188976,-0.1275637998597427,"I reverted your changes to the section heads at <url>, because I believe that References (when the section contains nothing but book titles and page numbers) is better than Notes, and that Bibliography is the best alternative to References when that header is already in use. But I'm keen to find out what's actually recommended - is there room for my preference?"
621356,0.4745669435423648,"Hmm... I'm new here at Wikipedia and your explanation is a little cloudy...Should I delink the references website?"
625793,-0.9470973691953024,"There's nothing in your history besides editing my page, so I'm not sure to what you are referring. What page are you talking about?"
599383,-0.4033613495578247,"<url> is the featured article on the main page.  Is that not supposed to be protected?"
580725,-2.0882062688025105,"Look dude, <url> was ALSO just deleted. What makes 2005 so special?"
403439,0.11635779830729928,"I rather got on my high-horse at <url>. Perhaps you can take a peek and tell me if my intuition has gone astray in this case of interpretation of <url>?"
624021,-1.0337564147644025,"Are you trying to help him milk the publicity over the WR incident? if it ends up on google with lots of nns why would that matter?"
627176,-0.2399424909146865,"You are just saying that <math>frac{f(x+h)-f(x)}{h}</math> is continuous at <math>h=0</math>, but that is not the same as saying <math>f'(x)</math> is continuous. Do you have any references?"
625432,0.6010552407954984,"Jason, how do you view your phone call to tlc's father&pastor in the light of the Biblical conflict resolution process? And in the light of the Wikipedian conflict resolution process?"
525643,-0.11095992050975964,"Hi Arcadian, regarding 'your' article on <url>, I think the classification as ""hexose deoxy sugar"" is clearly wrong, it would be rather something like ""methyl ether of a branched heptose dideoxy sugar"" but I'm not sure how chemists usually refer to such substances. Could you shed light on the issure?"
543585,-0.2736010489268573,"Do you mean that the envelope allows free ion passage? Or do you mean that the envelope, as a result of its pores, allows ion passage?"
217635,-0.20285207230712368,"APS = <url>. You lost me, which plant are you referring to above?"
169174,-0.2558770448037017,"This is what you stated from the page <url>.  Can you link to me the policy stating that minimum amount of content in an article, where it's not 'lacking in content,' is needed to be considered undue?"
187877,0.4268753154213332,"Is there any way to request a change to the citation template? For example, a <code>style=mla</code> parameter to render the values in MLA style?"
13528,0.9817738098744634,"I appreciate your effort to seek consensus through a merge proposal before merging <url> to <url>, but as you are no doubt aware, no one participated in the discussion, meaning that while there was no articulated consensus against it, there was also no consensus for it. May I recommend undoing the merge for now, re-opening the discussion, and seeking wider input at the relatively large number of WikiProjects that handle those articles?"
626505,1.236243119067748,"Perfect, thank you! Can you help with the phonetics of other Nordic languages?"
562572,0.4222374661741993,"Did make me smile....a dreamtime legend of a tiger in WA of all places. Seems a long way to walk, even when there was a land bridge ?"
620101,0.2264305778891805,"I see your point, but my real issue was wanting to add the 'too much trivia' tag as all these 'minor aspects' need to be integrated into the relevant sections (I'll have a go myself if I get time). Isn't it possible to create a 'pop culture references' section and then siphon it off into a separate page when it gets too big?"
566137,-1.0084886521760463,"Maybe I'm on crack, but in your edit summaries you're saying ""MT"" and ""Not MT"". What is MT an abbreviation for?"
9737,-1.1438954243302706,"I often work out of Sweden and I have an excellent, free, built-in English or Swedish grammar ''and'' spelling program in ''Word'' on that computer using Firefox (as this user says she does) - red underlinings for spelling and green for grammar - which would preclude almost all of the huge amount of problems caused by this user regarding readability, or at least alert her to the very quanitity of the problems and inspire a constructive attitude as to her own capacity. Perhaps if one does not consider it a ""duty"" of sorts to contribute readable English here, that actually might be the problem?"
542963,0.011525138255273572,"See: <url>. If I remember correctly, you said you planned on cleaning up after the bot tagged the images; is that still the case?"
206259,0.18354269791227854,"Also, both <url> and <url> wikilink ""hiatus"", which goes to a disambiguation page. What meaning of the word did you intend?"
565238,1.0154438736024625,"I saw your notes, and will watch for any objections.  If there are none, in two days, do you mind if I move that page and start the new categorization page/discussion?"
626078,-0.42112517320229254,"Your bot's edits aren't being marked as such; that is, they still appear in my watchlist when I choose to hide bot edits. Could you do something about this?"
124646,0.10521932006387684,"Hey, I saw your continued edits to <url> and hoped you were a resident - since I was hoping to get a photograph of the Capitol Theatre in the city. Any chance?"
59965,0.475404745407811,"Hi, not sure exactly what you are asking, the three web refs you list (IUCN, Birdlife, Audubon) all work fine for me, possible a server might have been down temporally, since these rarely give trouble otherwise? Or have I misunderstood your question?"
609780,0.2577849083783837,"Hi. How are you doing today, Haunted Angel?"
445909,0.514954699607581,"I'm curious what your reasoning is in saying <url>'s edits are in ""good faith"" and not blocking him when the two edits right before that were both vandalism of user pages. It seemed quite a slam dunk to me, did you happen to see something I missed?"
626690,-1.562176587894668,"In my calculation if I got blocked that would only be good for me as it would clear my mind from the obsession to try and change that which seems wrong and mutable, but carries no private benefits for the reformer. Is that line of thinking truly alien to you?"
383439,0.16785985868166606,"I noticed that you created the Close AFD script. Is it possible to edit it so that it works on all xFDs?"
183213,-0.1495107526212999,"Hi - I'm confused. I seem to have lost the note that you say I left on your page?"
154948,0.988078987941091,"Hi, I did post at <url> about the new Civil Ensign for Jersey but I've not had a reply yet. Any thoughts?"
179947,-0.5240286642955456,"I've also started <url>. Now is this acceptable?"
281599,-0.3706105655208932,"Well? What do you think?"
623033,0.963335962905972,"Sounds good to me. Shall we have a straw poll on it?"
2943,0.6648233964475463,"In the summer (June-July) I am going to work on the ''Messiah'' article. Would you like to be in on this?"
137324,0.2498744346204225,"I'm not sure how I caught this, but <url> made the same edits to <url> that blocked <url> made several years ago to <url> (which I have redir'ed because it is almost the same as the plastic pipework article).  Can the former be blocked for quacking despite a lack of recent activity?"
288077,1.0865438257895454,"I was at the library today looking through the back issues of ''Mojo'' and found a career-spanning Chili Peppers article from 2004. I read most of it, but I can go back next week and cite from it. Is there anything you want me to look for?"
126492,-1.7103671860717646,"So you're interested in both Amiga computers and BDSM! Are you an atheist too?"
522828,1.096368621832008,"Hello. Since you have contributed to <url> in the past, could you spare a minute to discuss the fate of <url>?"
618681,0.1289080720324864,"Also, how does the ""revert all edits"" function work?  Mainly, what do I put in the box for the secondary confirmation?"
200469,-0.07453747276858119,"What should I use on <url>, if I do choose to you money.  Should it be dollar or pound?"
595431,0.38366686105101455,"As for the Norwoods, both South Norwood and Upper Norwood are in Croydon, but West Norwood belongs to the LB of Lambeth. Does that help?"
464649,0.4192908925773413,"Fair nuff. Anyhow, somebody's birthday is coming up, is it not?"
531742,0.6104296547440387,"I took a quick look and I'm not up to reading through it properly at the moment. :) I'll be back on here tomorrow morning and I'll have a look then, if that's OK?"
460393,0.44447905736070853,"He's stumped about what the block is for, and so am I. Could you clarify?"
24386,-0.5411167433333969,"<url> is a validly notable topic which has been ruthlessly  suppressed at WP, probably because of egoism rather than religionist POV warriors but possibly both. Can you advise me on how to go about appealling deletions?"
394399,0.5945589889855155,"Hi Orlady, I wanted to seek your advice....Information on FIBAA is available in the German language on Wikipedia : http://de.wikipedia.org/wiki/Foundation_for_International_Business_Administration_Accreditation. Is there any chance to have it in English?"
494119,-0.3503771338165099,"Though your edit summaries say ""cat"" you seem to be on a mission against the word ""alumni"". Any reason for the purge?"
502232,-0.1948718581085948,"It look like <url>, is going to be on the Featured Content page. Where is the page that list what is on there when in the future, akin to the FA main page nominations page?"
620951,-1.145264433038415,"I don't see any of that in his deletion log.  Would you please find out which one it was as evidence so you're not blindly accusing an admin of deleting something they didn't delete?"
300687,-0.9896352351477612,"Thanks for the referrence.  Do you have any other response to the Bozo who doubts notability?"
618840,-1.0245366835509473,"OK, I'll bite. How is ''Matt ""Dirty"" Sanchez'' to be construed as anything other than a personal attack?"
217142,1.2540341158219568,"I seem to have adopted this article, since country music and dance are interests of mine. Can you recommend an easy to use bot that would help me in keeping those unwanted links out of the article?"
508465,1.2366208120904107,"Thank you for deleting the attack page I tagged.  Should <url> be blocked for creating it?"
43454,0.6799067539905854,"Good find. Do you have a cite for the second para?"
627256,-0.12033011580166245,"How does it feel being wikifamous??"
626341,-0.3019851858988355,"Maybe you can clarify what you meant by ""legal action"" then? Perhaps you just meant as opposed to illegal actions?"
626355,0.3827591121762841,"I have advised past attendees of this discussion. Does the last weekend of October work for you?"
204912,0.006868226588154841,"I just saw that pic you added to <url>.  Do you happen to know if that building is still standing?"
526692,0.6885186544070383,"Where do you suggest that I post the citation? In the ""USNA"" section or the ""Hispanic alumni section""?"
620012,-0.7340309192441139,"Read beyond the obvious. What is that essay saying when you remove all referances to users under blocks, bans or other sanctions?"
510884,0.11381113624078595,"Hmm it looks like it can't be done manually. Is something wrong in my program?"
620976,1.2167016626822933,"Okay, I will be glad to help you here! Could you please list the username you would want now?"
196682,1.355953691201225,"Thank you for catching Known for Know.  How did you happen to look at the article?"
185258,-0.221106751945582,"Da ti mene nisi sa nekim pobrkao? Kakve ja veze imam sa tim Faust Vranu010diu0107em?"
557635,0.6394818800628885,"Also, in accordance with <url>, I think the Turkish Army Corps should be 3rd Corps, 4th Corps, 5th Corps, not III Corps, IV Corps, V Corps. What do you think?"
525755,1.393539431963829,"Hi friend, I've noticed you've made some good edits over at the article. Are you a big fan of McGinley's work?"
354587,-0.29106590669558013,"Sorry, what? Could you be more specific please?"
488709,0.5331729941310634,"Elkman, there are other ways to take a Wikibreak. Can I help?"
575872,-0.5483311505036178,"You mean the links that are being edit warred over? I can, but first can you explain what the edit war was all about and what the point of the links are?"
407369,-0.2434554074807849,"I replied... also, are you watching that page?  If so, I will stop bothering you here?"
197207,0.056330230925931785,"BTW, are you having a problem with the orange strip that tells you that you have a message? Mine keeps on coming back when there is no message?"
542860,0.5284336241763055,"Hello? Whom do I speak to to become a <url>?"
133626,0.5980041291255004,"Thanks.  Beer?"
222,1.2837872691333416,"Splendid work on <url>! Do you have a copy of that reference, or use the library's?"
626197,-1.2716731922452815,"REVERT???"
619639,0.5577392930145612,"And after seeing this talk page, I'll also note that there is no difference between scalars in math, physics and computing, those articles should all be merged together. :-/ Maybe you'd be interested in doing such a merge?"
624806,-0.4936350723545629,"He's now been asked if he is ''the'' Alex Salmond and if not he should make that known. Imagine if he was?"
579195,-0.2452618212140173,"It's possible he may not be an english speaker. Do you know of a french version of that warning?"
621651,-0.007249708928698606,"It just doesn't make sense (to me) that we use a manga spelling for one name but a Simmons' spelling for another. Can't we just go along with Simmons on this one?"
621053,0.2700984592859752,"I've now blocked them as the account appears to be used only for vandalism. Since your username is prone to being mis-spelled can I suggest you set up some ""dead"" <url> accounts to pre-empt further impersonations?"
624626,-0.7378287231312994,"Please don't mention other languages when we're discussing the English wikipedia! Why are you limiting yourself only to the Abrahamic concepts of ''God''?"
516755,-0.04010222940422672,"Well, I'll review it anyhow, and we'll see where we need to go.  Deal?"
625272,-1.0486736038863445,"""Provocations""? How is it provoking to suggest to an American-expat that calling people in Taiwan ""Taiwanese"" is not controversial?"
389087,-1.2981017367712433,"Don't push it, Zachary. Can you give me proof of the existence of ""MusicMaximum Hot 100""?"
52088,0.5105172503497565,"Hey, I think that perhaps Raleigh Park should redirct to <url> rather the the Nottingham halls of residece article. Do you agree?"
