id,label,text
627426,-0.31422215849948204,"Iu2019m flattered that you have changed the meaning of minor in my honour, but I havenu2019t refused to engage in debate. What would you like to talk about?"
586496,0.4757880433086086,"<url> has been protected since July.  Do you think it might be okay to unprotect it now?"
568462,0.2285905619295936,"I wish to have my Wikipedia account deleted. Is that possible?"
74581,-0.13720712735287893,"About your last edit to <url>.  Do you have a source?"
629552,-1.6343032796123782,"You call what I did wikistalking yet these editors are allowed to do the same thing to me? Where's the sense in that?"
627832,-0.36219150847298814,"Which authorities are you referring to? Can you give the name of a linguist/grammarian who considers that removing the accents from a French, Polish or Serbian person's name creates an exonym?"
628571,-0.058151882127210876,"Thought of good idea: Wikipedia:Babies who will one day rule Wikipedia (WP:BABE) for Wikipedians in middle school or younger.  Whaddya think?"
247135,-0.4134455852612767,"Is there any kind of system for working on things? I mean, if you've taken something on, are you supposed to just do it and say so after the fact or are you supposed to mention it on the WikiProject Germany page?"
328920,0.3710302075959848,"The copyediting is being done as I speak. Anything else you can think of?"
622208,-1.3029834194416006,"Also, is <url> about chemistry, sociology, theology, international law, or what??  '''I''' know the answer to that question, but does the person reading the article know?"
463085,0.8071692828600923,"Thank you that clarifies matters. Has the image been listed for deletion on commons, or should I do so?"
620704,-0.5748291304175538,"There you go, it's GA now. Have you done anything else that's gotten to GA?"
84593,0.6343391601784375,"Sure AGK. Does the draft need to be updated to include the tweaks?"
256896,-0.6580288836295852,"Btw, what's ""WPC MOS"", and where/when was it decided that we don't use volume indicators? Why is this, and how do we distinguish between different volumes of series when mentioning issue numbers?"
344934,-1.151564214925647,"OK, then, define ""bias"", propose a way to quantify it, and if it's accepted by consensus, we'll apply it to ''all'' the admins on that page. Or, perhaps as a starting point, how about presenting some evidence?"
605883,0.07037899148398939,"<url> is directly from the <url> website. However it doesn't have any copyright notice should I still flag it as a copyvio?"
549682,0.5801439762502341,"As I wrote above, at first I thought lets keep it, but after I heard some arguments, and when I made analysis of my own, I got to my conclusion. What's yours?"
606020,0.2705112725028915,"You haven't contributed in over 10 days now. You alright?"
43587,1.019709220094362,"I disagree with your edit of the 21st of November.  Would you object to me inserting a new version based around the word 'Notwithstanding'?"
282680,0.5279155598753841,"Good idea.... Perhaps though you could also make a list of kings on that page??"
629191,-0.0015787160224260575,"This guy made a huge number of changes within minutes of creating <url>, including some annoying ones in the church categorization pages which I'm trying to clean up.  Can we deal appropriately?"
399975,-0.5336830664199333,"The reason given on the <nowiki><person></nowiki> tag (''""Non-notable book promo""'') seems to have nothing at all to do with the article. Is this on the correct article?"
585138,-0.33627740147712065,"I'm not totally sure what you mean. Are you asking for a list of all featured articles on the English Wikipedia?"
478708,1.264640794144814,"Nice work so far on your rewrite of ""The One After the Superbowl"". Are you planning on including info about the Diet Coke fiasco?"
226220,0.8443331175216725,"Hi Finell: I have filed an RfC at <url>. Could you take a look at this matter and proffer some advice?"
608241,-0.1038483994751772,"The Gestalt Prayer (and it's modified version missing the last line, as the article explained) is of cultural and historical importance. Why was it removed?"
564739,0.5644604796640516,"The proper title of this image should be Eszopiclone.svg, since it depicts the S enantiomer. Could you change the title so I can upload an image of the racemic compound instead?"
243621,0.24670413317227285,"Hi, I found two sources which state that <url> was still married and when she moved to Harlem with her Husband. Do you have any sources to the contrary?"
102225,0.35457151617824,"I just reverted your addition of a fossil range template to <url>, because with only an arrow at the very right it didn't seem to add much useful information. Perhaps we could make a separate template to show only the Cenozoic or so, which would allow us to show more detail in these fossil ranges?"
488272,-0.13359105521578346,"Nothing messed up from where I'm sitting. What kind of messed up?"
96067,-0.941358624579062,"I notice that your userpage announces that this is an alternate account and won't get involved in policy. Did you always have that attitude, or is it since December last year?"
629786,-0.4027310874081271,"And NO Igor, discuss edits with ME please. Are you proposing to discard the mentorship agreement?"
464033,0.045652897982915885,"You said that the Category: ""Songs Performed on 'Make Your Own Kind Of Music'"" might be deleted. Could you explain your reasoning?"
402148,1.1520644908645494,"Due to certain Edits the page alignment has changed. Could you please help?"
497186,-1.4941534919877932,"I fail to see how you call copyleft ""selfish"", but are fine with the idea of totally proprietary licenses. Wouldn't those be even more selfish, then?"
616622,-0.568511862510667,"The reason given on the <nowiki><person></nowiki> tag (''""Non-notable book promo""'') seems to have nothing at all to do with the article. Is this on the correct article?"
479498,0.955962793155433,"Heh, thanks. Do you know of any scripts that might come in handy?"
264811,0.11138502252030406,"I.m keen to see your recent abbey article on the main page, but there are no references. Can this be fixed?"
245897,0.6397723617196369,"Thanks for the revert on <url>. Kinda curious how this blanking is always done by IPs that trace back to USAF installations isn't it?"
620200,0.6758386288285482,"Also perhaps we should set up a subpage for these discussions, so we'll have the thread completely on one page?  What do you think?"
264394,-1.0880861909912185,"Would you like to elaborate? How are you empowering me exactly?"
493706,0.4470440353557791,"Hi Tim. As I've seen you editing it recently, I won't delete it but... do you think <url> deserves an article at present?"
152054,0.4710098474444733,"The early life and early carreer can be incorporated into the article, I believe.  Did you want to finish the whole CAA article rewrite first or put part of the rewrite into the article?"
235897,-0.6385806875968477,"Are you both ""Dribblingscribe"" and ""Indiestu"" ? Do both those accounts belong to the same person?"
622661,0.2878193189941473,"Thanks, just for me to understand this in depth, ""tumbarse"" can not refer to the breaking of waves, or the waves coming roling in, ""las olas se tumban"" etc, but ONLY a beach chair? Is that what you are saying?"
226224,0.9943350922299724,"The block seems to no longer be necessary or productive. If I were to bring a motion to get them unblocked, would you support it?"
619337,0.03922141685809253,"Okay, I read through it (skimmed through some parts as they are largely repetitive). I think maybe a good place to bring this up would be in <url>?"
421765,-1.1309604076094917,"On a more practical note: One either does or doesn't agree to take part in mediation. Which is it, please?"
625515,0.31795414236319613,"The block has indeed expired.  What message are you getting when you try to edit?"
627023,-0.6165517423363776,"You just added it again. Maybe you should look over the guidelines for inclusion of the tag?"
233978,-0.10921599573773892,"I believe it was I who moved it, based on what appeared to be consensus to use the hyphen in that context.  Where is this guideline of which you speak that suggests otherwise?"
202035,-1.249050553283888,"Let me ask you this.  Assuming we take it that the player might have chosen any door to start with and the host may have opened any unchosen goat-hiding door, why do you not insist that the starting sample space must include all the possible door combinations?"
493516,0.2929538849816026,"I suspect so - though with the size of things it may be best to assess each one individually. Using the formal name of the region was copied from the London category which had already been started - maybe we could add disambiguators on an individual case by case basis?"
4026,0.6350854407739798,"My question is ""Why?"" I am doing all the citations correctly and this still appears often. Can anyone tell me what I'm doing wrong?"
478499,-0.10993247148156993,"I'll have a look (probably just for copyediting duties) once Zag has finished the larger changes. Keep me posted?"
454245,-1.6739265193304529,"How did I vandalize!!??"
620305,-0.5269527265567112,"you could have started the discussion yourself. How can you say there was no consensus against the edits if there had been no discussion at the time you were doing the reverting?"
291841,-0.17290350882774416,"Sure, but what's the deal with fair use and cropping?  I thought the Zatanna one got removed?"
622861,-0.2658676870082385,"Thailand has no dates.  Where do you look it up to get those?"
342431,-1.7944763558885004,"???You wat?"
452368,-0.13889369071023444,"""two pigeons in a row constitute a half-wave antenna at 700 MHz"" That's a pretty cool intersection of radio invisible waves seems-like-magic and real-life objects! On the other hand, did you perhaps just crack the secret for implementing <url>?"
460482,0.5925573418573501,"So it seems we both already know the problems with the current logo and the SVG one. What can I do to help you?"
489947,-2.4964135880274343,"As a former administrator, and therefore a veteran editor who knows how wikipedia really works, I am actually surprised you would even ask such a question with such an obvious answer. I suspect you were simply pointing out a perceived injustice with a question founded in a <url> that you yourself did not take seriously?"
628427,-1.0346924349910818,"A remarkably modern-sounding name for something being applied to articles on people who've been dead for centuries. You really think it's appropriate for <url> ?"
273881,-0.3286231148054674,"Be that as it may, and not to quibble with your block, but I did some research and I've found that this puppeteer does in fact exist - the Washington Post described him as a ""master"", for instance, and Woodcarver Online calls him a ""leading puppet artist"". May I ask why you decided that the creation of the article was indicative of socklike behavior?"
479573,0.7986342875338897,"Thanks! :) So we're allowed to do multiple revdels at a time now?"
620942,1.0878930638252469,"Well, lyrics are generally frowned upon on Wikipedia, unless the song is old enough that its copyright no longer applies. Could you perhaps link to the article?"
368987,0.07102317706838279,"I don't like the idea of switching the order halfway through, especially as you would you have to decide an arbitrary cut-off point. Perhaps you should raise this on <url>, and see what people think?"
623072,-1.700766347582174,"And now you undid my declination of that one which was copyrighted. Would you ''please'' quit undoing my declinations?"
202054,-0.14890294104092047,"I know that this has been discussed before by various editors, but can anybody give me a reason why the problem is normally formulated in terms of the door numbers (1,2,3) and not the objects behind the doors (the car, goat 1, and goat 2).  Is this just because the door are given numbers in the problem statement but the goats are not given names?"
73194,-0.4824954279902618,"Vi is out of the hospital.  Did I mention that she was in?"
448525,-0.08242241389812484,"I don't understand the system there. What does bold mean?"
345899,-1.4655328461429251,"What do you mean they are not related to the scope of <url>? Like which articles?"
349707,0.6324067321222809,"Is it ok to use words like: here are some ""good"" or ""recommended"" reliable secondary sources?  Or does that have to be determined by consensus?"
628757,-0.5466419677475162,"Wait, I thought algorithms were named for <url>???"
104082,0.13503414546972953,"Hello-I think you know more about <url> than I do. Want to check it?"
257822,1.122941009366109,"Good work maintaining the Tibet page i seems to getting an increasing amount of traffic!!! Is our Chinese friend still persisting?"
552159,0.2463748607264597,"It would be nice if there was an optional protection expiration date, similar to how administrators are able to block for a definite amount of time (15 minutes, 24 hours, permanently, et cetera).  Are the developers able to implement this?"
341902,-0.3889873728669217,"<url>. Do you think it has any chance?"
544689,-0.7432943990153471,"You're acting very oddly today: You've just reverted two separate edits on <url>, saying they were the phrasing of the Lancet, but neither references the Lancet, and it seems unlikely that both would have the same statement applying to them. Have you been hacked?"
624484,-1.8205236185034652,"Where is the exception in <url> for ""tossing out citations and verifiable in order to make it easier for the reader""?  Who are you to disagree with Nikon's label of ""Compact Professional""?"
79929,0.5684519316891516,"Perhaps you can help me. How do I view the status of a vandalism report I've made?"
317892,-0.4103864496402789,"it was not the first fully automated space docking operation with a space station, like I said progress does it all the time, they use the same system made by the russians. Can you find a source for that?"
397562,-0.488455342281047,"Please explain this <url>. Is there a valid reason why this image was removed?"
470032,-0.6599356311847252,"Reply: I have just found your edits to the talk page of the above article - not impressive at all? I suggest that you take this to <url> and explain why his edits need to be reverted and not yours?"
505691,-0.02584120274531281,"Thank you for fixing your edit. But why did you make it in the first place?"
185533,0.4339097233511436,"Thanks for the link to the Flag template WikiProject at the MoS discussion. Has there been much discussion at the WikiProject about the limits/usefulness of flag icons?"
251401,1.0763281176489,"Hey, I saw you edited the Dark Tower Series page. I was just wondering if you were a fan of the series?"
475617,-0.013441997293607929,"Hey, so your move of this, and wanted to point out that the reason I put a disambig title on it, was because there are two different labor unions of the same name, either one of which could wind up with an article. But, I don't know that that means the article should automatically get the title, is there a standard for this situation?"
387960,-0.04116982687440409,"I have never heard of the 1933 ""freakish heat flash"" in Coimbra, Portugal. Will you please provide some sources that you used for forming such a conclusion?"
61921,-2.1337417294818484,"The haven't first team appearances for gods sake! How can you say they deserve an article?"
582890,0.3191071749442005,"That's fine. Question: how did you find that out?"
222405,1.1587768294643437,"Hey, Another editor and I are confused by your resent edit. ""Should the non-AQ qulify for the BCS Championship, and face either the Big Ten or Pac-10 Champion, the Rose Bowl may replace that champion with a team from same conference, so long as it is in the Top 14 of the final BCS Standings"" Could you please clarify it for us?"
526748,0.6603648745889298,"At first I couldn't see it, but now that I've taken a closer look I see what you mean.  Now, I wonder, who was the first most decorated PR soldier in WW II?"
546576,1.41479800745452,"A little while back, at the beginning of November, I had said that if you ever were considering adminship, that I would love to support and/or nominate you.  Do you have any interest in pursuing it?"
480160,0.8409160484498662,"There may not be a lot of situations like this, but there will definitely be some. I was wondering if there is any kind of invisible comment that can be added to the article in these situations so that the report doesn't include it, or if you have any other thoughts about how it might be possible to handle this situation?"
137459,-0.6803463485221906,"Just wondering, is there any reason why you removed categories from a number of articles and replaced them with the non-existend <url>. Wouldn't <url> have been the better choice, which, as it appears, is a category you yourself created a few days ago?"
104464,0.17624913652817542,"I noticed that you twice placed a request for citation on the <url> page,<url> <url>, but it was silently removed by <url> <url>. I've removed the sentence altogether; do you think any other action should be taken at this point?"
625525,0.7652997693090678,"You make some good points.  How do you feel about nominating the article for AfD then?"
196858,1.0487465160826084,"Hello, our project has begun to fall a little bit behind the collaboration/organization department, would you, as an experienced editor be willing to help us revamp how we deal with issues? The template is a little behind because of this, but it points to some good places:) Do you have anything in particular you would like to do with us?"
621480,0.8919013402228934,"Thanks. As an aside, since this did turn out to be factual, just very hard to source, do you think the community would countenance an unblock request from Blaabla if he accepted some strict unblock conditions (such as packing in the 'systemic bias' thing, discussing his edits in a less confrontational manner etc)?"
344279,-0.5883429901400243,"<url> Am I missing something?"
565610,-0.14269749957306693,"DONE. Do you think everything is now sorted so I can beep Brain Boulton?"
71498,-0.15777103057671454,"Who inherits the chiefship of <url> now? Does ''legitimatio per subsequens matrimonium'' apply?"
297092,1.2265222629431882,"Thanks for your assistance in the review of the Brian Keith review at the DYK! The user has cited the Internet Movie Database before?"
256895,-0.13333838754454302,"Yep. Ain't it fun when we agree?"
619945,-0.051770869158744806,"I've now dealt with the RFI report. Any others while I'm at it?"
232433,0.4137694468049901,"It should be deleted. Do you want to nominate it or should I?"
313815,0.14736423176086105,"Hey ! There is a little problem on that image you uploaded from Lambiek : Caran d'Ache is supposed to be 2 years old in 1860, but his ''moustache'' and tallness let me think he is not so young... Do you know where to find the real date of the picture ?"
628435,0.17370250107290905,"Ok, you are now an admin on the Wiktionary and Wikiquote, but I can not make you a sysop on a wiki that doesn't exist, so you're not one at Wikibooks yet. Are you sure it is sensible to create three new projects at once in this language?"
332438,0.6192770518244997,"4. I had once felt that the Euroleague, Italian and Greek leagues were the top leagues. If I were to choose selected European leagues from this page <url>, do you have any thoughts on which ones are important?"
375626,0.08384840475751859,"It would be even funnier if you did attend the rally but weren't the giant tea bag guy I added to your user page. Did you?"
79211,0.05806363636569874,"Is as usual being overrun with pointless blather. Would you like to set up a subpage to discuss sources?"
129287,-0.3953445942075871,"Fair enough. So when can I change it back without getting blocked?"
496173,-0.09776092974811773,"It would seem to me that this category provides no overall benefit to wiki and only serves as another list of organizations which seem to be targeted by the generally negative tone of LGAT articles. Would it make more sense, or be more proper, to include the relevant categories on the individual articles themselves, rather than have an LGAT category?"
520857,-0.3335197348794329,"In the stub note you just wrote, there appears on my screen a purple word that  looks sort of like 'st^b .  I suppose this is supposed to be IPA for ""stub"", but why here?"
486504,-0.3865135535028316,"Staeckerbot has notified me five times so far about the same images - see <url> page history. Perhaps it's because the images in question are edit protected?"
215322,-0.5536787783154553,"Afterthought: where did you get your figure of 82500 tons pa??"
622055,0.36018578573556864,"That's really nice! Did you decide against seeing vervandelt as dependent on ""sich""?"
451272,0.8312021633071925,"Likewise there is some discussion at <url>, where <url> is categorising itself and its documenttation. Could you please fix that as well?"
569299,0.13947562008760356,"An AfD was started for that page before you speedy-nuked it. Could you close <url> please?"
325216,0.2354684463290481,"Hello, I and a few others have made many edits to <url>.  Do you have any more comments and can you be persuaded to change your vote?"
628610,1.0999329952578485,"I'm sorry, I'm having trouble understanding your question. Could you try again?"
630160,-2.3309431136252488,"''SO!?!?'', what has it got to do with you?"
370484,0.1727897977191839,"CG, seems <url> is under attack as having an insufficiently global focus.  Can you add anything there about Australian variants?"
232110,-0.8723692363900662,"Please answer Bishonen question to you. When were you invited to comment on UC related subjects?"
120147,0.37854721569176053,"I think we're ready for FAC now. As the two top contributors, perhaps we should co-nom?"
619898,0.0759909421888457,"Have you and I reached a compositional (English, not content) impass? Perhaps we should hash it out away from the article and install after having reached teh big A (accomodation or agreement)?"
9038,-0.8337000445096896,"Your bot takes zh:u514bu91ccu65afu6258u5f17xb7u6885u7b56u723eu5fb7 off of the Christoph Metzelder page. What exactly is wrong with it?"
460330,0.18182272250538456,"This why 399 is disabled as well? The times I looked it wasn't using very many conditions; what did you see?"
482914,-0.058848652592458216,"I see you deleted this page a while back as an attack page.  Any chance that the information originally had anything to do with the John Lamb mentioned in <url>?"
399040,0.04464963359668628,"That's making the fundamental assertion that the second source is reliable. Can you prove that it is?"
582288,-0.4844991979021144,"If the only page you've been visiting is Wikipedia, then it makes sense the viruses would come from here, but if you've been to other sites, they get thrown into the equation. Again, don't you have any anti-virus software?"
92911,-0.24006246852091045,"Sure. Aside from the Flea and Frusciante articles, which get the most traffic?"
620147,-0.4213234028106345,"So you haven't found a flaw in any of their ideas themselves? As regards your other comment, are you saying that all Muslims are equally capable of finding out the truth about Islam?"
343268,1.5175010318443267,"I've steadily become more interested in getting this article up to FA, but I'm having trouble finding sources that actually analyze ''contemporary R&B'' instead of the entire <url> genre. Do you have any advice or would you be interested in working on it together?"
557667,0.36103103592661534,"Are the Maroon Berets the four Army commando brigades? If they're not part of the army, which service are they part of?"
601738,0.5356857110580855,"As does ''<url>'', and ''<url>'', and even ''<url>''. Wanna be friends?"
412885,-0.553833775299489,"I figured I would ask you directly, since you objected to my original draft, and it seems to be difficult to workshop specific problems in the general discussion taking place at <url>.  How is <url>?"
186448,0.6444812964226465,"I think this deserves its own article, as opposed to being in the centrifugal one. Do you have any good sources that describe how it works?"
301146,0.4846943371921285,"You recently deleted my photograph of Harrington, NSW stating 'blatant copyright infringement', I'm not sure how you came to this conclusion as I took this photograph myself and authorise it for use under a creative commons licence. I'm no expert at Wikipedia and am not sure how to get the photograph back; would you be able to restore the image and the link to it on the Harrington, NSW Wikipedia page?"
630689,1.0027801691173797,"You come across as a contributor who possess great depth. Are you a history professor/ student?"
185432,-1.3405820193608091,"Anyway, the point is that the bot is editing against <url>. Can you let me know whether you intend to continue or whether we can agree that you'll stop using it to do this?"
40290,1.0616678170490994,"Hi Zaps, I've noticed that you edited the abovementioned article. Could you please provide your sources?"
299583,-0.008461887167923643,"Hello, csloat. What is your response to my suggestion <url>?"
628331,0.896927241421341,"I'm sorry, but I don't see the edit if you're referring to the <url> article.  Are you referring to something else?"
580856,-0.1244304584361568,"Could you please explain to me what the buttons do? How do you ""Not accept"" a change, that's what...you revert it, don't you...?"
283318,-1.307216813086342,"Jeez, Joe, and I was going to suggest you hang around Andrea's to make sure he doesn't do himself a disservice... What is this? Getting blocked is the new cool?"
621299,-0.003955037813185359,"I'm responding here in an effort to keep the conversation in one place and would appreciate it if you would do the same. Did you see where I said above that images which only allow non-commercial use are still considered to be non-free?"
