id,label,text
37564,-0.1419193660176714,"A quick question: I've noticed that people (including yourself) have been moving links to other wikis from the top of the article to the bottom. If this a good thing to do, then I can do likewise, but I wondered if there was a rationale / convention here?"
140016,-1.8614201529721337,"If you're going to accuse me of operating in bad faith, then the discussion has become inappropriately personal.  On what grounds do you make such an implication?"
395934,-0.7515940115992275,"Just to let you know, there's a <url> now. I don't know, is this mimicry allowed on Wikipedia?"
621156,-0.35040521778635003,"I am not involved at all i any governmental or  anti-drug organization or any pro- or anti-drug organization of any kind. If you don't have any claims on the sources, what is then not in line with Wikipedeia policy in the article?"
144711,-1.5671952066095134,"So I got rid of it. Have a little faith in my good judgment, okay?"
472643,0.2704698737330288,"What just happened? Is this recent or the stuff that happened a few days ago?"
129255,-0.7428265219661967,"What's with all the crap behind him? Was this at a signature desk?"
97672,-1.1069732479215266,"Hmmm, you are basically asking me to think positively despite evidence and knowing that over this issue none good faith on part of some users was showed in past, but ok, letxb4s see how it goes. The question then is: do you consider including the discussions with outside mediation participants that happend on those talk-pages (direktor, for exemple, has been very active and enthusiastic there lately) or only the in-mediation discussions are the ones that count?"
459409,-0.3793762402758988,"Please put them all back!  Are you on DSL?"
587956,-0.06899820410853955,"Third, what picture then should go into the Harrison Ford infobox?  Would this one (Image:Harrison Ford 1) do it?"
473194,0.6550275020577048,"Sounds good. Could you drop Fritzpoll a note?"
278828,0.23161961080186974,"Hi I saw you mentioned that DirecTV has plans to add MSNBC HD upon launch on <url> but the source you referenced has nothing about DirecTV in it, its just about the HD launch itself, so I removed it per <url>. Do you have a source that specifically says DirecTV WILL add it upon launch?"
335369,-0.6167927093594345,"I just noticed you've added me as a sock puppet for Blue Sea? Can I ask what led you to this conclusion?"
509299,0.11654157951844785,"Point taken. Would you like to be a mod?"
441283,-0.4918429529433291,"Eh. Awesome as in you are going to be more active?"
559607,-1.3386145343185398,"Why did you delete see also section in Puerto Rico? why did you delete the political parties?"
459272,0.5572873537541293,"Thanks for the heads up.  What damage did they do?"
344363,0.533160679530573,"pls see my comments on your revert on the talk page.  Perhaps you'll consider undoing my revert?"
357026,0.5075290879082437,"Well done on adding references, I've expanded intro to cover whole article but what i've added needs to be tightened a little. Looks close to GA, were you going to nominate soon or planning to take to FAC?"
507962,-0.2553211339843631,"Thanks, but I'd prefer to leave my talk page open to vandalism. No harm done if it's on a talk page, right?"
45783,-0.3447502780478033,"I just sat through last Sunday's horror show... The less said about that the better. Any idea who Maurice LaMarche voiced so I can update the guest star list?"
137285,0.2456936208100033,"The thread about the interaction ban between Haymaker and me was archived without being closed. Would you mind pulling it out so we can end this?"
261906,0.6512067350291763,"Yellowmonkey has told me we need another FAR delegate and recommended you for the job. Is that something you're willing to do?"
619630,0.5639859659855537,"Do you know how to make the 'All Star Template' appear only at the bottom, as well as the 'Confirmed future sites', so the actual table appears at the top of the page??"
574952,0.7590715489845054,"I have indicated on <url> that, should you be desyopped, I will immediately re-nominate you for sysop.  Would you accept the nomination if I did?"
109554,0.6938690410149402,"Thank you, I was wondering what type of unit this was. Civil Defence, some kind of police squad, or perhaps even Freikorps?"
369370,0.18757188389076,"Lots of books contain prominent claims on one of the first pages along the lines of ""any reproduction of this book blah blah blah is prohibited"", often this is found even on books in the public domain. Am I entering into a binding contract by continuing to read the book?"
369700,-0.20705141561665608,"This is one of those rare situations where I really have no idea what to say. Thanks?"
42991,0.3056893892590414,"What is your objection?  Would a split address your concerns?"
556231,1.075622917062536,"Hi, I see you voted ""support"" but in the neutral section. Would you like to move that to the support section?"
584305,1.3268819206054343,"Thank you, Cremepuff222, for the kind words. :) How have you been?"
626004,0.3717173802818413,"Well, that was an example as I am adding Infobox Historical American Political Party infobox to all those historical parties in <url> for which I was previously using the regular Infobox American Political Party until I found the Historical version in <url>.  So if I wish to continue, I will have to assign colors and shortname to all of them if not already done (like Anti-Masonic Party) right?"
619724,-1.3330075403151724,"Compare the two. How is the first in anyway superior to the second?"
38386,0.5353204967989271,"The <url> page said that <url> will be shown on the <url> subchannels 26.5 and 26.6, and also on analog channel 48. It is also expected that The U Too will displace Me Too from analog channel 48. If that's the case, then, where do you suppose Me Too will end up? What new channel in Chicago will it be shown on?"
619867,0.22521777334700324,"Ah okay. In that case I'm going to tag it for deletion as a redundant redirect, if that's okay with you?"
152922,0.2873031741530153,"Hi. Are you still a ""maybe"" for the meetup?"
284104,-1.5714587244235978,"What do you mean by ""not a derivative of Formula 3 article""? Why did you feel compelled to remove the link to the main F3 article off the top of all the F3 sub-articles?"
290158,0.2896644414745809,"Hey i saw you make an edit i have a question do mods only do this? how does this process work?"
346297,-1.3995697219150809,"Oh? You know something I don't, Friday?"
417263,-0.705852093012669,"Not too sure now you come to mention it. Do i need to annihilate it?"
624988,0.24542546654170716,"Sorry I got called away. Which is the better main name ""Vancouver Harbour Water Aerodrome"" or ""Vancouver Coal Harbour Seaplane Base""?"
476075,-0.23131118903696574,"For example, take a look at <url> and <url>. What supports this?"
524052,-1.1207148077823372,"It was closed as ""no consensus, default to keep"".  What difference does it make?"
544739,-0.9308320525085818,"That was awfully quick, considering that it was open for less than 12 hours.  Since I must now do them individually, must they be considered ""Second Nominations"" if I put them up again?"
77514,0.36097646954459495,"Hi WeHope. Another small issue at the DYK nom page, could you take a look?"
464157,-0.16213599337840087,"I have now created <url> and <url>.  I wonder if a similar template may be warranted for listifying (CfL)?"
172545,-0.4807208588438825,"Iulius! Could you provide exact  reference of article u017dirmu016bnai part ''Demographics'' ethnicity  composition?"
83791,-0.5229252096916919,"Why are you uploading/changing badge files here? Surely you should just upload them to Commons then list the wikipedia version for deletion?"
39531,0.4129823817053293,"Unfortunately the 4chan page you linked to in <url> does not exist now. Can you give a pointer to what is involved?"
560278,-0.12159546241521413,"Transport not geeky if an area is unserviced. Are nights and w/ends?"
625377,-0.598577596082443,"You said: ""I am just upset that you are harassing a person who seems to be trying to better himself and his relationship with fellow wikipedians.""  First, I'm harrassing no-one, and it would be better if you didn't make such accusations.  Secondly, what evidence do you see that SS is trying to do anything of the kind?"
207757,-0.34476202172618625,"By the way, Hammersoft, I am willing to have a fair view of Delta. So, tell me: What good things has he ever done?"
472594,-0.3974670919904505,"And, by the way, shouldn't there have to be actual copyright VIOLATIONS (not just a lack of a machine-readable tag) to delete a photograph? Or are we so concerned with making our project bot-friendly that it doesn't matter if we lose really great images in the process?"
387713,-0.773953262590184,"Are you saying that you have a close or imtimate relationship with N.I.?"
27650,0.21227281951475369,"Hi. Do you have permission under <url> to use <url> on Wikipedia?"
625248,1.3555352482336107,"Thank you for the response on my user page.  Would you be willing to add a few words to the FAC candidacy?"
244336,1.3139550758835656,"Thanks very much for your edit to the <url> article. Would you be interested in tackling the <url> of <url>?"
171044,-1.7250669145864528,"<person> I find this conversation remarkable given that you have twice opted to edit war over referencing format to the detriment of an article's quality in the last 24 hours on <url>. What gives?"
623988,0.9184649343132648,"I have started to fix it.  Can you help?"
103616,-1.1506808169469604,"Oh and you seem to have deleted half of the stuff on <url> ... I presume this was a mistake?"
623925,0.9101662094348189,"My graphics editing skills aren't up to the creation of a map such as this from scratch, but I could probably do an adequate job of removing the red and orange lines and the related entries in the map legend. Would it be useful for me to take a whack at that?"
625810,0.34609335173878814,"I can't spend too much time, and I'm no specialist, but with those limitations I'd be willing to help out. Btw, how is your name pronounced?"
476462,-0.007698020000774597,"This is a toughy. Do you think it could be integrated with <url>?"
621768,1.0271675926284838,"Thanks. Before I use, is there are way to deny the bot only within a portion of an article rather than the entire article?"
175620,-0.30753083910490514,"I don't get it. How a meeting in Vilnius on a bridge across Niemen could have taken place or had any impact on anything if the river does not flow thru the town?"
253511,-0.26337930503746165,"Hi. What was wrong with the Autamata page?"
496920,0.26490719790523254,"Not really sure what the remedy is for this, but anyway, now you know. How was your weekend?"
487163,0.4616094463787768,"You mentioned an hour long video that included about 25 minutes of Will Wright just talking. Do you know where I could get a copy of this?"
16027,0.3766246571829093,"Jvhertum, Last year you made this change :http://en.wikipedia.org/w/index.php?title=A_Split-Second&action=historysubmit&diff=343316267&oldid=343252107 to the <url> article with the justification that ""A is part of the name"". This does not appear to be a valid reason to exclude it (<url> has a DEFAULTSORT of Beatles despite 'The' being part of the name), your thoughts ?"
273774,0.22259620726612386,"Hi sarah, it is taking a while for Longhair to get back to me on a couple of things. Is he on wikibreak or something?"
623775,0.6790626062981133,"The link you provided to speedy delection criteria only goes up to CSD12, and there is no CSD 13 listed there.  Could you clarify?"
576879,-0.05434822973604492,"I noticed that you removed the section "" Failure to prevent the attacks"" from the 9/11 attacks talk page yesterday and moved it unceremoniously to <url> without a single word of explanation. Please explain why?"
330884,1.087828956645159,"Thanks for your work in cleaning up <url> (which is now finished, but for a few hard cases which likely will require the writing of articles to conform to those links). Would you like to collaborate on another section of this list?"
83698,-0.0719897761230941,"I would load them into commons.  How do I do that?"
68624,-0.06486987013531353,"Didn't get it. What is it about?"
626740,-0.1538538416645477,"That's nice. May I ask why you noticed this?"
625151,1.4124276869152397,"No worries, please, dear - I'll keep this stage open at least until tomorrow night if you wish. Sounds ok to you?"
167001,0.3146624549966554,"I noticed you have improved the ""human rights"" section on the article <url>. Could you update the main article: <url>?"
608307,0.2255539364146681,"Basically, I agree with you. <url>, right?"
475741,0.5802599601871875,"Oh, okay. <url> should be placed as a ""see also"" on <url>, correct?"
575597,0.003191652271197209,"On this <url> you set the longitude seconds to 67 when converting  to a template.  Any idea what the real value should be?"
585611,0.04336808751697865,"I think you're referring to <url>? For example, <url>?"
544288,0.07825122399934886,"Oh, in that case you want <url>. So Vigen Geodakyan is your father?"
584126,-0.3393658828981042,"Is your name like A <url>? Is the 'A' a negation as to imply that you are not squid?"
300169,0.19462980970155647,"Steineresque! Shall I have a go, or will you?"
551679,0.206797671464965,"The discussion page at <url> does not note that semi-protection has been removed. Would you be willing to note your action there?"
619559,1.222893648689658,"Thanks for providing the IPA of <url>. can you help further in copyediting the text?"
621208,0.4692870920029665,"Hi, what was the image you are having problems with? Was it <url>?"
431031,-0.6780685582641526,"I had to revert another one <url>. How about that protection?"
137337,-0.5798346025712144,"Eeeeerrrrr... Could you type a little slower, I am having trouble with the above!?"
604463,-1.6765745720907532,"Say what? And what does this have to do with ""Happy New Year"" and my pretty picture?"
39454,-0.3813449980164871,"Which was, to my knowledge, notabilified. Is that a word?"
624684,0.16417310626212975,"Another thing: <url> has created <url>. What do you think about it?"
553944,-0.2304105450341993,"The article <url> (written with two s) was rightly deleted as it contained almost no content (Timothy (Tim) Ferriss is the author of The 4-Hour Workweek). I think you mean the science-fiction writer <url> (written wit one s) ?"
403226,-0.9874684600634996,"Yeah I have.  Yes I know that; you saying I'm a malicious admin?"
214946,1.1067083104436484,"Hey, several of the footnotes that you use in <url> are Harvard footnotes, which means that they need the full citation of the books in works cited section. I imagine you grabbed some of that information from some other places, would you mind retriveing the bibliographic data?"
623536,0.5644713600252751,"The section starting with '''a philosophical defeat, etc''' is somewhat informal in style.  Could you try to eliminate solecisms when you get a chance?"
53741,0.9385327659431576,"Thanks for letting me know.  Is it considered a subspecies?"
623626,0.13184479679510575,"Done. Can you take care of <url> and <url>?"
384109,0.15719412316936732,"I feel <url> is a personal attack against me. Can you please remove it for me per <url>?"
454482,-0.8477677372373034,"Owing to your status as an active wikipedian, I'm not yet reverting your edit to this article.  But what sense is it to move his birth location from the birthdate position in line one, to the top of (a newly formed) paragraph 2 which then (continues from the former paragraph 1 subject) takes off on a subject entirely unrelated to his birth?"
505413,-0.06600844110873996,"I notice that you are using a very old version of my monobook script. Have you considered updating it?"
139754,0.5140510755375407,"Not offended - let's talk about it.  Doesn't ""Avatar"" refer to the series as well as the character?"
553065,0.7772083950378842,"Regarding <url>, <url>, <url>, <url>, <url> and <url>, may I redirect them? Should I leave the merge tag on the talk page?"
72875,-2.1273908207501093,"You are being very insulting on <url>. Can't you just trust the strength of your arguments, instead of insulting people who are doing their best to help improve Wikipedia?"
473110,-0.08801804324813976,"OK, maybe I only started noticing it after that incident. Do you have diffs for your earlier opinions?"
493035,-0.007429394969474814,"I noticed you delinked 1993 in the MGM Grand Las Vegas article <url>.  What is MoS?"
372654,0.5053470773722044,"Thanks terribly for looking it up. Would it be alright for me to use the new source in Europe, economy section then?"
493958,0.44050053440891573,"I have developed a <url> showing the holders of the senior positions in the shadow cabinet since 1945. I thought that it might be of some use somewhere on English wiki, but it doesn't seem to fit with the current schemes for the <url> page, or the <url> page. Any ideas on where the table might go?"
276582,0.01131318633514351,"I see you've created the page <url>. Are you by any chance related to the Hondo Hurricane?"
272220,1.4360160981262124,"Thanks for improving the article.  Can you add categories also?"
207726,-1.2413274081178556,"So, Pasquale, you're not interested? Have you ever read <url> article?"
52370,-0.21145463798421812,"About 3,500 hits per day at the moment, and the article is terrible. Could you lend a hand?"
546077,1.0359792124860836,"I've nominated a biology-type article, <url>, at <url>. Would you be interested in reviewing it?"
232367,-0.15464983062782042,"Don't stop editing. Maybe a request at <url> would be of use?"
27314,0.9891418271545817,"I noticed that you did some work on this article, and would like to expand it to include his recommendation (in ''Can Life Prevail'') that the UN develop hit squads to target large urban population centers (with neutron bombs as I recall), and also the discussion on the 9/11 terrorists being ""superior moral human beings"" for their actions.  Understanding that this is a BLP, that NPOV is important, and that including secondary sources is nearly impossible as they are difficult (at best) to find, what is your feeling on this?"
193247,0.8157498654361642,"Hi MariAna, there are just a couple of outstanding issues with the article. Could you have a look at them so I can get the GA closed in the next few days?"
406829,0.7443664314549523,"I do have one semi-newbie question: I made some edits under my IP before registering (<url>) and would like to ""claim"" them now that I have registered. Do you know if that's possible, and if so, how to go about it?"
85093,0.3901695691122053,"I have attempted to address your concern. Could you take another look at the article?"
263108,-0.2512941226658769,"Sheesh.  What else did I miss in May and June?"
321479,0.0648429324076672,"02:33, 25 February 2008 24.47.208.127 (Talk) (58,755 bytes) (u2192Suicide: added external link to Marlborough Gallery (Marlborough Fine Art)) (undo)-------is this the place for a link to this gallery site? I don't know yet how to think on such matters--will you have a look?"
398326,-0.7212557514341634,"I am not equally confident about this pinning one: <person>. Hector again?"
622316,0.7128559245948585,"Well, in that case we should simply point the shortcuts to where they originally pointed, which in most cases is unrelated to both VIE and VINE. That sounds like a fair and neutral compromise, no?"
434439,-0.14654003389168954,"You appear to have created a duplicate of <person> at <person>. Is there any particular reason for this?"
180947,-0.14288790178105554,"Before I prod this article. Do you want to save it by adding some independent citations to it to say why it's important independently of UNE?"
163563,0.592227568734573,"Hello im trying to make a task force for the Empire of Brazil with some people but we dont know how to make the actually task force stuff like the banner and how to make the quality chart template to see what class each article is. Im asking if you can help make it since i saw you made WikiProject Dam?"
262826,-0.21642580482074095,"I'm not sure if you've changed your opinion of the article's FAC status, but I think you have guided us in a ton of good ideas.  Have you changed your opinion?"
628665,-1.5174719035281463,"Can I also point out that the text that you pasted into Wikipedia is entirely inappropriate for an encyclopedia article and at best will require extensive editing to conform to the<url>. Are you going to do that editing, or are you going to leave it to one of the other 'lazy' people who edit this encyclopedia?"
470852,-0.6873605576497571,"Where have you put this material? On a user page somewhere?"
327034,-0.22786297467116706,"ah - not thinking there. I've left Mackle though for now - is he back at Hearts?"
593405,0.907550767280876,"Just a question about the maintenance categories that FemtoBot automatically creates each month: I've noticed that the bot is frequently forced to recreate old, long-deleted monthly categories in the <person> queue, because an article got reverted to an old version for one reason or another and resulted in the old category being temporarily repopulated again. I'm just putting this forward as an idea for discussion, and am certainly not wedded to it u2014 but just to keep things simpler for everyone, I wonder what you would think about the feasibility and/or desirability of recoding the bot so that when it encounters a repopulated old maintenance category, it would retag the article to the ''current'' month instead of recreating the old one?"
258490,1.9251889443150343,"Your <url> is a brilliant idea! Would you mind if I linked to it from my collection of ""Useful things"" on my user page?"
471470,0.3853419041581005,"What would be needed is for a human to check the list, do various filters, and then suggest values for the missing data. What is the best format to return the data in, having in mind the idea to get a bot to add the data?"
483157,0.3619651186940343,"Your block of the <url> article came immediately after three edits that blanked sourced content without any explanation. These edits were unrelated to the edit war that got the article blocked, so could you please to restore the content?"
101345,-0.2654939787988041,"This IP - 188.50.98.153, its intention seems to be language fundamentalism, gave a level-3 warning....Any way to protect this article so that only established users can edit it??"
50897,-0.15819118649926914,"If you read the <url> article, you'll see that the locos were rebuilt. Is it possible that the E1 class were the rebuilds of the 118 class?"
333431,-1.5402303802356516,"On second thought, the mix of pseudo-politeness, vulgarity and threats is...really creepy. Could ya...stop?"
264769,-0.032308573172178015,"I assume you mean the one that ends in .net? If a specific link appeared on this page, and then removed because whoever added it immediately realised it was a copyvio, I can see what we can salvage?"
506970,0.4658647100600601,"Hello...I looked up <url>, and found that this person is a previous vandal. Is this sufficient to block the user, since more vandalism was done on Cold War article?"
629836,-0.5236735474554755,"You also did three reversions. Where are the administrators, meanwhile?"
62466,0.6188945757905808,"I think the article needs work. For example, I think ""U.S. late 1980s - 1990s"" should after ""Detroit sound."" ""UK 1990s"" should after ""U.S. late 1980s - 1990s."" What do you think?"
581772,-1.094270791952888,"The review has been up there for something like six weeks, I notice. Think you'll be able to take care of those last couple of things?"
179847,0.06660234459208154,"Hi, I have opened a discussion at <url>. Perhaps you would like to contribute?"
604319,-0.7185888647753018,"<url> suddenly has a bunch of new entries for today. Did you change the program?"
619805,0.28284248909205045,"Hi again. Are you still participating in the discussion at Talk:Kirk Cameron?"
624756,-0.6266266882446212,"I know what the band Rush is.  I'm just wondering if you were joking or didn't know the user was referring to Rush Limbaugh?"
506047,-0.0022941950514876464,"Is the bot correct and if so can I assume that is the standard to follow ??"
625680,0.0899387623520832,"It needs to be redirected anyone can do that. Is there any information that is in the article that is not in <url>?"
469365,-0.761720434570607,"I Mean hes been really sucessful why not???"
627626,0.1548638489028232,"That was a <url>, rather than an <url>. Is that what you intended?"
415276,-0.02752464005599261,"Which ID section are you asking about? The first one, where you insert pictures or very short text, or the long one, where you write the long text?"
622063,-1.0530242334758395,"Lowell/Lawrence Blvd leading from Lowell to the Methuen Rotary is a device from hell as well.  How many people does that short stretch of road have to kill?"
559786,0.606531270930509,"OK, same situation here :-)  Marskell and I agreed on a proposal that would initially just give us some backup on the day-to-day stuff, not necessarily closes, but to work in to people who could help when we needed time off.  Is it OK with you if I go ahead and propose that to Raul?"
133829,-0.26856910585809435,"A talk page is like your office desk. How does the typical office desk of a professor look like?"
144125,-0.3568245519346743,"Why did you ""nowiki"" the unblock template?  Is it just here for show, or do you want it to be considered?"
416937,0.21834089347912475,"Still doing vandalism reverts by hand I see. Need any help?"
570803,-0.521439629650154,"Thanks Bro, it is better to ask is the stead of jumping out and getting a disgruntled Admin on my back. And why would you continualy :: bludgeon yourself over the head with your keyboard when you have my jokes?"
599361,0.7479484698500205,"Hi, <url>. Do you have a suggestion as to how these article make Wikipedia better?"
